{
  "user_name": "test1",
  "user_group": "writing_b2",
  "user_group_display": "写作 B-2",
  "submitted_text": "第一部分：故事概括\r\n在一个永生药物改变人类命运的世界中，一位被排除在外的“迷失的一代”成员在85岁时发现药物的致命副作用，他在揭露真相的过程中，面临着保护自己享受永生药物的后代的艰难选择，最终揭示出人性复杂却充满希望的本质。\r\n\r\n第二部分：第一幕\r\n故事开始于主角28岁时，科学家宣布发现一种可以阻止衰老的药物，政府决定只提供给26岁以下的公民，主角和他的同龄人被称为“迷失的一代”，被排除在外。随着时间的推移，主角目睹自己的孩子享受永生的特权，而他自己则逐渐老去，心中充满不甘与失落。当他85岁时，主角偶然发现永生药物的副作用正在悄然显现，威胁着所有使用者的生命。\r\n\r\n第三部分：第二幕\r\n主角开始调查药物的真相，发现政府早已知晓副作用却选择隐瞒，为了保护自己的利益。随着调查的深入，他结识了一群同样被排除在外的“迷失的一代”成员，他们决定联手揭露真相。在这个过程中，主角面临来自政府的威胁和内心的挣扎，他必须在揭露真相和保护自己享受永生药物的后代之间做出艰难选择。随着时间的推移，药物的副作用愈发明显，社会开始动荡不安，而他的后代也因担心而与他产生冲突，但最终选择支持他的决定。\r\n\r\n第四部分：第三幕\r\n在最终对决中，主角和他的盟友们成功揭露了药物的真相，迫使政府公开承认错误并停止药物的分发。已经使用药物的人面临着逐渐失去永生效果的恐慌和健康问题的威胁，社会陷入混乱。尽管这一胜利来之不易，但主角意识到人类对永生的追求终究无法逃避自然规律。他选择回归平凡的生活，珍惜有限的时光，与家人和朋友共度余生。主角与后代在经历了风雨后更加珍惜彼此，故事以主角的内心平和结束，展现出在复杂的人性中仍然存在希望与爱的力量。",
  "scores": {
    "Character Depth & Moral Dilemma Arc": 7,
    "Memory Anchors & Sensory Specificity": 5,
    "Intergenerational Span & Long-term Causality": 8,
    "Institutional & Tech Ethical Complexity": 8,
    "Investigative Drive & Clue Architecture": 6,
    "Multi-layered Conflict": 7,
    "Value Turns & Causal Cohesion": 7,
    "Hierarchy of Beats & Midpoint/Climax Design": 7,
    "Emotional Punch & Aftershock": 6,
    "Dual Resonance of Ending: Personal & Public": 8
  },
  "justifications": {
    "Character Depth & Moral Dilemma Arc": "The protagonist faces a significant moral dilemma, choosing between revealing the truth about the drug and protecting his descendants. This choice leads to an internal transformation, but the character's internal reasoning and emotional journey could be more deeply explored.",
    "Memory Anchors & Sensory Specificity": "The narrative lacks specific sensory details or recurring memory anchors that could enhance emotional depth. The focus is more on plot progression than on sensory or emotional triggers.",
    "Intergenerational Span & Long-term Causality": "The story effectively spans multiple generations, highlighting the long-term consequences of the protagonist's choices. The contrast between the protagonist's aging and his children's eternal youth is well depicted, providing a strong temporal framework.",
    "Institutional & Tech Ethical Complexity": "The depiction of government actions is multifaceted, showing both self-interest and fear. The government's decision to withhold information about the drug's side effects adds complexity and directly impacts the protagonist's choices.",
    "Investigative Drive & Clue Architecture": "The protagonist's investigation into the drug's side effects drives the plot, but the clues and evidence could be more intricately layered to build suspense and tension.",
    "Multi-layered Conflict": "The narrative presents conflicts on internal, interpersonal, and institutional levels. These conflicts are interconnected, though the internal conflict could be more pronounced to enhance the protagonist's emotional depth.",
    "Value Turns & Causal Cohesion": "The story features clear value shifts, such as trust turning to suspicion. These shifts are generally well-linked through a causal chain, though some transitions could be smoother.",
    "Hierarchy of Beats & Midpoint/Climax Design": "The narrative structure is clear, with a significant midpoint where the protagonist decides to reveal the truth. The climax is impactful, though the escalation of tension could be more pronounced.",
    "Emotional Punch & Aftershock": "Key scenes have emotional impact, particularly in the protagonist's relationships, but the aftershocks of these emotions could be more deeply explored in subsequent scenes.",
    "Dual Resonance of Ending: Personal & Public": "The ending resonates on both personal and public levels, with the protagonist finding peace and society grappling with the consequences of the drug. It maintains moral ambiguity and avoids simplistic resolutions."
  },
  "metrics": [
    {
      "name": "Character Depth & Moral Dilemma Arc",
      "score": 7,
      "justification": "The protagonist faces a significant moral dilemma, choosing between revealing the truth about the drug and protecting his descendants. This choice leads to an internal transformation, but the character's internal reasoning and emotional journey could be more deeply explored."
    },
    {
      "name": "Memory Anchors & Sensory Specificity",
      "score": 5,
      "justification": "The narrative lacks specific sensory details or recurring memory anchors that could enhance emotional depth. The focus is more on plot progression than on sensory or emotional triggers."
    },
    {
      "name": "Intergenerational Span & Long-term Causality",
      "score": 8,
      "justification": "The story effectively spans multiple generations, highlighting the long-term consequences of the protagonist's choices. The contrast between the protagonist's aging and his children's eternal youth is well depicted, providing a strong temporal framework."
    },
    {
      "name": "Institutional & Tech Ethical Complexity",
      "score": 8,
      "justification": "The depiction of government actions is multifaceted, showing both self-interest and fear. The government's decision to withhold information about the drug's side effects adds complexity and directly impacts the protagonist's choices."
    },
    {
      "name": "Investigative Drive & Clue Architecture",
      "score": 6,
      "justification": "The protagonist's investigation into the drug's side effects drives the plot, but the clues and evidence could be more intricately layered to build suspense and tension."
    },
    {
      "name": "Multi-layered Conflict",
      "score": 7,
      "justification": "The narrative presents conflicts on internal, interpersonal, and institutional levels. These conflicts are interconnected, though the internal conflict could be more pronounced to enhance the protagonist's emotional depth."
    },
    {
      "name": "Value Turns & Causal Cohesion",
      "score": 7,
      "justification": "The story features clear value shifts, such as trust turning to suspicion. These shifts are generally well-linked through a causal chain, though some transitions could be smoother."
    },
    {
      "name": "Hierarchy of Beats & Midpoint/Climax Design",
      "score": 7,
      "justification": "The narrative structure is clear, with a significant midpoint where the protagonist decides to reveal the truth. The climax is impactful, though the escalation of tension could be more pronounced."
    },
    {
      "name": "Emotional Punch & Aftershock",
      "score": 6,
      "justification": "Key scenes have emotional impact, particularly in the protagonist's relationships, but the aftershocks of these emotions could be more deeply explored in subsequent scenes."
    },
    {
      "name": "Dual Resonance of Ending: Personal & Public",
      "score": 8,
      "justification": "The ending resonates on both personal and public levels, with the protagonist finding peace and society grappling with the consequences of the drug. It maintains moral ambiguity and avoids simplistic resolutions."
    }
  ],
  "overall_summary": "The narrative presents a compelling exploration of the ethical and personal dilemmas surrounding a world-altering drug. It effectively combines personal and societal conflicts, with a protagonist who must navigate complex moral choices. The story is well-structured, with clear intergenerational themes and a nuanced portrayal of institutional ethics, though it could benefit from deeper character development and more vivid sensory details.",
  "total_score": 69,
  "ai_response": "===EVALUATION_START===\nOVERALL_SUMMARY: The narrative presents a compelling exploration of the ethical and personal dilemmas surrounding a world-altering drug. It effectively combines personal and societal conflicts, with a protagonist who must navigate complex moral choices. The story is well-structured, with clear intergenerational themes and a nuanced portrayal of institutional ethics, though it could benefit from deeper character development and more vivid sensory details.\n\nCRITERION_SCORES:\nCRITERION_1|Character Depth & Moral Dilemma Arc|7|The protagonist faces a significant moral dilemma, choosing between revealing the truth about the drug and protecting his descendants. This choice leads to an internal transformation, but the character's internal reasoning and emotional journey could be more deeply explored.\nCRITERION_2|Memory Anchors & Sensory Specificity|5|The narrative lacks specific sensory details or recurring memory anchors that could enhance emotional depth. The focus is more on plot progression than on sensory or emotional triggers.\nCRITERION_3|Intergenerational Span & Long-term Causality|8|The story effectively spans multiple generations, highlighting the long-term consequences of the protagonist's choices. The contrast between the protagonist's aging and his children's eternal youth is well depicted, providing a strong temporal framework.\nCRITERION_4|Institutional & Tech Ethical Complexity|8|The depiction of government actions is multifaceted, showing both self-interest and fear. The government's decision to withhold information about the drug's side effects adds complexity and directly impacts the protagonist's choices.\nCRITERION_5|Investigative Drive & Clue Architecture|6|The protagonist's investigation into the drug's side effects drives the plot, but the clues and evidence could be more intricately layered to build suspense and tension.\nCRITERION_6|Multi-layered Conflict|7|The narrative presents conflicts on internal, interpersonal, and institutional levels. These conflicts are interconnected, though the internal conflict could be more pronounced to enhance the protagonist's emotional depth.\nCRITERION_7|Value Turns & Causal Cohesion|7|The story features clear value shifts, such as trust turning to suspicion. These shifts are generally well-linked through a causal chain, though some transitions could be smoother.\nCRITERION_8|Hierarchy of Beats & Midpoint/Climax Design|7|The narrative structure is clear, with a significant midpoint where the protagonist decides to reveal the truth. The climax is impactful, though the escalation of tension could be more pronounced.\nCRITERION_9|Emotional Punch & Aftershock|6|Key scenes have emotional impact, particularly in the protagonist's relationships, but the aftershocks of these emotions could be more deeply explored in subsequent scenes.\nCRITERION_10|Dual Resonance of Ending: Personal & Public|8|The ending resonates on both personal and public levels, with the protagonist finding peace and society grappling with the consequences of the drug. It maintains moral ambiguity and avoids simplistic resolutions.\n===EVALUATION_END===",
  "created_at": "2025-08-28T13:00:09.312599+00:00"
}