{
  "user_name": "test1",
  "user_group": "writing_b1",
  "user_group_display": "写作 B-1",
  "submitted_text": "第一部分：故事概括\r\n在一个永生药物改变人类命运的世界中，一位被排除在外的“迷失的一代”成员在85岁时发现药物的致命副作用，他在揭露真相的过程中，面临着保护自己享受永生药物的后代的艰难选择，最终揭示出人性复杂却充满希望的本质。\r\n\r\n第二部分：第一幕\r\n故事开始于主角28岁时，科学家宣布发现一种可以阻止衰老的药物，政府决定只提供给26岁以下的公民，主角和他的同龄人被称为“迷失的一代”，被排除在外。随着时间的推移，主角目睹自己的孩子享受永生的特权，而他自己则逐渐老去，心中充满不甘与失落。当他85岁时，主角偶然发现永生药物的副作用正在悄然显现，威胁着所有使用者的生命。\r\n\r\n第三部分：第二幕\r\n主角开始调查药物的真相，发现政府早已知晓副作用却选择隐瞒，为了保护自己的利益。随着调查的深入，他结识了一群同样被排除在外的“迷失的一代”成员，他们决定联手揭露真相。在这个过程中，主角面临来自政府的威胁和内心的挣扎，他必须在揭露真相和保护自己享受永生药物的后代之间做出艰难选择。随着时间的推移，药物的副作用愈发明显，社会开始动荡不安，而他的后代也因担心而与他产生冲突，但最终选择支持他的决定。\r\n\r\n第四部分：第三幕\r\n在最终对决中，主角和他的盟友们成功揭露了药物的真相，迫使政府公开承认错误并停止药物的分发。已经使用药物的人面临着逐渐失去永生效果的恐慌和健康问题的威胁，社会陷入混乱。尽管这一胜利来之不易，但主角意识到人类对永生的追求终究无法逃避自然规律。他选择回归平凡的生活，珍惜有限的时光，与家人和朋友共度余生。主角与后代在经历了风雨后更加珍惜彼此，故事以主角的内心平和结束，展现出在复杂的人性中仍然存在希望与爱的力量。",
  "scores": {
    "Character Depth & Moral Dilemma Arc": 8,
    "Memory Anchors & Sensory Specificity": 5,
    "Intergenerational Span & Long-term Causality": 9,
    "Institutional & Tech Ethical Complexity": 7,
    "Investigative Drive & Clue Architecture": 6,
    "Multi-layered Conflict": 8,
    "Value Turns & Causal Cohesion": 7,
    "Hierarchy of Beats & Midpoint/Climax Design": 7,
    "Emotional Punch & Aftershock": 7,
    "Dual Resonance of Ending: Personal & Public": 9
  },
  "justifications": {
    "Character Depth & Moral Dilemma Arc": "The protagonist faces a profound moral dilemma between revealing a dangerous truth and protecting his descendants. His internal conflict is well-developed, with clear motivations and an irreversible transformation by the end.",
    "Memory Anchors & Sensory Specificity": "While the narrative hints at emotional depth, it lacks specific sensory details or recurring memory anchors that could enhance the emotional resonance and plot progression.",
    "Intergenerational Span & Long-term Causality": "The story effectively spans generations, highlighting the long-term consequences of the protagonist's exclusion and the societal impact of the drug, with clear age markers and intergenerational contrasts.",
    "Institutional & Tech Ethical Complexity": "The government is portrayed with some complexity, showing self-interest and fear. However, the depiction could benefit from more nuanced exploration of institutional motives and internal conflicts.",
    "Investigative Drive & Clue Architecture": "The investigation into the drug's side effects drives the plot, but the narrative could improve by detailing the risks and costs associated with evidence gathering to enhance suspense.",
    "Multi-layered Conflict": "The story features internal, interpersonal, and institutional conflicts that are well intertwined, pushing the protagonist to a critical decision point and creating a rich narrative tapestry.",
    "Value Turns & Causal Cohesion": "The narrative includes clear value shifts, such as trust to suspicion, but could further strengthen causal links between scenes to avoid any perceived coincidences.",
    "Hierarchy of Beats & Midpoint/Climax Design": "The structure is solid, with a clear midpoint and climax. However, the escalation of stakes and the irreversible nature of the climax could be more pronounced for greater impact.",
    "Emotional Punch & Aftershock": "Key scenes deliver emotional impact, particularly in the protagonist's relationships, but the aftershocks could be more deeply explored to maintain tension and emotional resonance.",
    "Dual Resonance of Ending: Personal & Public": "The ending successfully addresses both personal and societal dimensions, maintaining moral ambiguity and highlighting the enduring complexity of human desires and ethical challenges."
  },
  "metrics": [
    {
      "name": "Character Depth & Moral Dilemma Arc",
      "score": 8,
      "justification": "The protagonist faces a profound moral dilemma between revealing a dangerous truth and protecting his descendants. His internal conflict is well-developed, with clear motivations and an irreversible transformation by the end."
    },
    {
      "name": "Memory Anchors & Sensory Specificity",
      "score": 5,
      "justification": "While the narrative hints at emotional depth, it lacks specific sensory details or recurring memory anchors that could enhance the emotional resonance and plot progression."
    },
    {
      "name": "Intergenerational Span & Long-term Causality",
      "score": 9,
      "justification": "The story effectively spans generations, highlighting the long-term consequences of the protagonist's exclusion and the societal impact of the drug, with clear age markers and intergenerational contrasts."
    },
    {
      "name": "Institutional & Tech Ethical Complexity",
      "score": 7,
      "justification": "The government is portrayed with some complexity, showing self-interest and fear. However, the depiction could benefit from more nuanced exploration of institutional motives and internal conflicts."
    },
    {
      "name": "Investigative Drive & Clue Architecture",
      "score": 6,
      "justification": "The investigation into the drug's side effects drives the plot, but the narrative could improve by detailing the risks and costs associated with evidence gathering to enhance suspense."
    },
    {
      "name": "Multi-layered Conflict",
      "score": 8,
      "justification": "The story features internal, interpersonal, and institutional conflicts that are well intertwined, pushing the protagonist to a critical decision point and creating a rich narrative tapestry."
    },
    {
      "name": "Value Turns & Causal Cohesion",
      "score": 7,
      "justification": "The narrative includes clear value shifts, such as trust to suspicion, but could further strengthen causal links between scenes to avoid any perceived coincidences."
    },
    {
      "name": "Hierarchy of Beats & Midpoint/Climax Design",
      "score": 7,
      "justification": "The structure is solid, with a clear midpoint and climax. However, the escalation of stakes and the irreversible nature of the climax could be more pronounced for greater impact."
    },
    {
      "name": "Emotional Punch & Aftershock",
      "score": 7,
      "justification": "Key scenes deliver emotional impact, particularly in the protagonist's relationships, but the aftershocks could be more deeply explored to maintain tension and emotional resonance."
    },
    {
      "name": "Dual Resonance of Ending: Personal & Public",
      "score": 9,
      "justification": "The ending successfully addresses both personal and societal dimensions, maintaining moral ambiguity and highlighting the enduring complexity of human desires and ethical challenges."
    }
  ],
  "overall_summary": "The narrative presents a compelling story set in a world transformed by a life-extending drug. It explores themes of exclusion, ethical dilemmas, and the consequences of technological advancements. The protagonist's journey from exclusion to revelation is marked by moral complexity and emotional depth, culminating in a nuanced resolution that balances personal and societal implications.",
  "total_score": 73,
  "ai_response": "===EVALUATION_START===\nOVERALL_SUMMARY: The narrative presents a compelling story set in a world transformed by a life-extending drug. It explores themes of exclusion, ethical dilemmas, and the consequences of technological advancements. The protagonist's journey from exclusion to revelation is marked by moral complexity and emotional depth, culminating in a nuanced resolution that balances personal and societal implications.\n\nCRITERION_SCORES:\nCRITERION_1|Character Depth & Moral Dilemma Arc|8|The protagonist faces a profound moral dilemma between revealing a dangerous truth and protecting his descendants. His internal conflict is well-developed, with clear motivations and an irreversible transformation by the end.\nCRITERION_2|Memory Anchors & Sensory Specificity|5|While the narrative hints at emotional depth, it lacks specific sensory details or recurring memory anchors that could enhance the emotional resonance and plot progression.\nCRITERION_3|Intergenerational Span & Long-term Causality|9|The story effectively spans generations, highlighting the long-term consequences of the protagonist's exclusion and the societal impact of the drug, with clear age markers and intergenerational contrasts.\nCRITERION_4|Institutional & Tech Ethical Complexity|7|The government is portrayed with some complexity, showing self-interest and fear. However, the depiction could benefit from more nuanced exploration of institutional motives and internal conflicts.\nCRITERION_5|Investigative Drive & Clue Architecture|6|The investigation into the drug's side effects drives the plot, but the narrative could improve by detailing the risks and costs associated with evidence gathering to enhance suspense.\nCRITERION_6|Multi-layered Conflict|8|The story features internal, interpersonal, and institutional conflicts that are well intertwined, pushing the protagonist to a critical decision point and creating a rich narrative tapestry.\nCRITERION_7|Value Turns & Causal Cohesion|7|The narrative includes clear value shifts, such as trust to suspicion, but could further strengthen causal links between scenes to avoid any perceived coincidences.\nCRITERION_8|Hierarchy of Beats & Midpoint/Climax Design|7|The structure is solid, with a clear midpoint and climax. However, the escalation of stakes and the irreversible nature of the climax could be more pronounced for greater impact.\nCRITERION_9|Emotional Punch & Aftershock|7|Key scenes deliver emotional impact, particularly in the protagonist's relationships, but the aftershocks could be more deeply explored to maintain tension and emotional resonance.\nCRITERION_10|Dual Resonance of Ending: Personal & Public|9|The ending successfully addresses both personal and societal dimensions, maintaining moral ambiguity and highlighting the enduring complexity of human desires and ethical challenges.\n===EVALUATION_END===",
  "created_at": "2025-08-28T12:59:08.246896+00:00"
}