{
  "user_name": "刘彦淞",
  "user_group": "writing_a1",
  "user_group_display": "写作 A-1",
  "submitted_text": "工具结果执行结果\r\n第一部分：故事概括\r\n\r\n在一个因永生药物引发社会不平等的未来，85岁的主角揭露药物的致命副作用，挑战不公制度，唤醒被遗忘的“迷失的一代”，最终推动社会变革，呼唤人们重新审视生命的真正价值。\r\n第二部分：第一幕\r\n\r\n故事开始于主角28岁时，科学界宣布发现一种能阻止衰老的药物，但政府只将其提供给26岁以下的公民，主角和“迷失的一代”被排除在外。面对教育、医疗、住房等方面的巨大压力，政府推出永生药物作为缓解社会矛盾的解决方案，然而，主角心怀不满却无能为力，只能看着年轻一代享受永生的特权。随着时间推移，主角逐渐接受了自己的命运，直到85岁时，药物的副作用开始显现，年轻一代的健康状况急剧恶化，社会陷入恐慌。\r\n第三部分：第二幕\r\n\r\n主角意识到这是揭露真相的机会，他开始调查药物的真实影响，并与其他“迷失的一代”成员联手，收集证据。随着调查深入，主角发现政府和制药公司早已知晓副作用，却选择隐瞒真相以维持权力和利益。药物的副作用不仅导致身体机能的崩溃，还引发了严重的心理问题，年轻一代的精神状态逐渐恶化。主角面临内心的挣扎，是否要冒险揭露真相，最终在一次公共演讲中，他勇敢地揭示了药物的危害，引发社会的广泛关注和抗议。\r\n第四部分：第三幕\r\n\r\n在社会动荡中，主角和他的盟友们面临来自政府和制药公司的强烈反击，但他们坚定不移，继续推动真相的传播。最终，随着越来越多的证据曝光，政府被迫承认错误，停止药物的分发，并开始研究解决方案。主角在这一过程中找到了内心的平衡，虽然无法获得永生，但他通过自己的努力改变了社会的不公，迎来了一个更加公平的未来。结尾处，人们开始反思生命的意义，意识到真正的永生在于对生命价值的理解和珍惜。",
  "scores": {
    "Character Depth & Moral Dilemma Arc": 6,
    "Memory Anchors & Sensory Specificity": 4,
    "Intergenerational Span & Long-term Causality": 7,
    "Institutional & Tech Ethical Complexity": 5,
    "Investigative Drive & Clue Architecture": 6,
    "Multi-layered Conflict": 7,
    "Value Turns & Causal Cohesion": 6,
    "Hierarchy of Beats & Midpoint/Climax Design": 6,
    "Emotional Punch & Aftershock": 5,
    "Dual Resonance of Ending: Personal & Public": 7
  },
  "justifications": {
    "Character Depth & Moral Dilemma Arc": "The protagonist faces a moral dilemma in deciding whether to reveal the truth about the drug's side effects. While the internal conflict is present, the character's internal motivations and transformations could be more deeply explored to enhance emotional impact.",
    "Memory Anchors & Sensory Specificity": "The narrative lacks specific memory anchors or sensory details that could enhance the emotional depth and connection to the protagonist's past and present experiences.",
    "Intergenerational Span & Long-term Causality": "The story effectively uses an intergenerational timeline, contrasting the protagonist's life at 28 and 85, and showing the long-term consequences of societal decisions on different generations.",
    "Institutional & Tech Ethical Complexity": "While the government and pharmaceutical company are central to the plot, their portrayal lacks complexity and nuance, appearing more as antagonistic forces without a detailed exploration of their motivations.",
    "Investigative Drive & Clue Architecture": "The protagonist's investigation into the drug's effects drives the plot, with evidence gathering creating tension. However, the narrative could benefit from more detailed and layered clues to enhance suspense.",
    "Multi-layered Conflict": "The story presents conflicts on multiple levels—personal, interpersonal, and societal. These conflicts are interconnected, but the interpersonal dimension could be further developed for greater depth.",
    "Value Turns & Causal Cohesion": "The narrative includes value shifts, such as the protagonist's decision to reveal the truth, but these shifts could be more cohesively linked through detailed causal chains to avoid abrupt transitions.",
    "Hierarchy of Beats & Midpoint/Climax Design": "The story has a clear structure with escalating tension leading to a climax. However, the midpoint could be more distinct in changing the narrative's direction, and the climax could be more surprising.",
    "Emotional Punch & Aftershock": "Key scenes, such as the public revelation, have emotional impact, but the aftershocks of these events could be more pronounced and explored in subsequent scenes to deepen the emotional resonance.",
    "Dual Resonance of Ending: Personal & Public": "The ending addresses both personal and societal changes, with the protagonist finding inner balance and society reevaluating life values. However, the resolution could retain more ambiguity to reflect ongoing societal challenges."
  },
  "metrics": [
    {
      "name": "Character Depth & Moral Dilemma Arc",
      "score": 6,
      "justification": "The protagonist faces a moral dilemma in deciding whether to reveal the truth about the drug's side effects. While the internal conflict is present, the character's internal motivations and transformations could be more deeply explored to enhance emotional impact."
    },
    {
      "name": "Memory Anchors & Sensory Specificity",
      "score": 4,
      "justification": "The narrative lacks specific memory anchors or sensory details that could enhance the emotional depth and connection to the protagonist's past and present experiences."
    },
    {
      "name": "Intergenerational Span & Long-term Causality",
      "score": 7,
      "justification": "The story effectively uses an intergenerational timeline, contrasting the protagonist's life at 28 and 85, and showing the long-term consequences of societal decisions on different generations."
    },
    {
      "name": "Institutional & Tech Ethical Complexity",
      "score": 5,
      "justification": "While the government and pharmaceutical company are central to the plot, their portrayal lacks complexity and nuance, appearing more as antagonistic forces without a detailed exploration of their motivations."
    },
    {
      "name": "Investigative Drive & Clue Architecture",
      "score": 6,
      "justification": "The protagonist's investigation into the drug's effects drives the plot, with evidence gathering creating tension. However, the narrative could benefit from more detailed and layered clues to enhance suspense."
    },
    {
      "name": "Multi-layered Conflict",
      "score": 7,
      "justification": "The story presents conflicts on multiple levels—personal, interpersonal, and societal. These conflicts are interconnected, but the interpersonal dimension could be further developed for greater depth."
    },
    {
      "name": "Value Turns & Causal Cohesion",
      "score": 6,
      "justification": "The narrative includes value shifts, such as the protagonist's decision to reveal the truth, but these shifts could be more cohesively linked through detailed causal chains to avoid abrupt transitions."
    },
    {
      "name": "Hierarchy of Beats & Midpoint/Climax Design",
      "score": 6,
      "justification": "The story has a clear structure with escalating tension leading to a climax. However, the midpoint could be more distinct in changing the narrative's direction, and the climax could be more surprising."
    },
    {
      "name": "Emotional Punch & Aftershock",
      "score": 5,
      "justification": "Key scenes, such as the public revelation, have emotional impact, but the aftershocks of these events could be more pronounced and explored in subsequent scenes to deepen the emotional resonance."
    },
    {
      "name": "Dual Resonance of Ending: Personal & Public",
      "score": 7,
      "justification": "The ending addresses both personal and societal changes, with the protagonist finding inner balance and society reevaluating life values. However, the resolution could retain more ambiguity to reflect ongoing societal challenges."
    }
  ],
  "overall_summary": "The narrative presents a compelling story set in a dystopian future where a protagonist from the \"lost generation\" challenges societal inequality caused by a life-extending drug. The story effectively uses a personal journey to highlight broader social issues, culminating in a transformative societal change. However, the narrative could benefit from deeper character exploration and more nuanced depiction of institutional complexities.",
  "total_score": 59,
  "ai_response": "===EVALUATION_START===\nOVERALL_SUMMARY: The narrative presents a compelling story set in a dystopian future where a protagonist from the \"lost generation\" challenges societal inequality caused by a life-extending drug. The story effectively uses a personal journey to highlight broader social issues, culminating in a transformative societal change. However, the narrative could benefit from deeper character exploration and more nuanced depiction of institutional complexities.\n\nCRITERION_SCORES:\nCRITERION_1|Character Depth & Moral Dilemma Arc|6|The protagonist faces a moral dilemma in deciding whether to reveal the truth about the drug's side effects. While the internal conflict is present, the character's internal motivations and transformations could be more deeply explored to enhance emotional impact.\nCRITERION_2|Memory Anchors & Sensory Specificity|4|The narrative lacks specific memory anchors or sensory details that could enhance the emotional depth and connection to the protagonist's past and present experiences.\nCRITERION_3|Intergenerational Span & Long-term Causality|7|The story effectively uses an intergenerational timeline, contrasting the protagonist's life at 28 and 85, and showing the long-term consequences of societal decisions on different generations.\nCRITERION_4|Institutional & Tech Ethical Complexity|5|While the government and pharmaceutical company are central to the plot, their portrayal lacks complexity and nuance, appearing more as antagonistic forces without a detailed exploration of their motivations.\nCRITERION_5|Investigative Drive & Clue Architecture|6|The protagonist's investigation into the drug's effects drives the plot, with evidence gathering creating tension. However, the narrative could benefit from more detailed and layered clues to enhance suspense.\nCRITERION_6|Multi-layered Conflict|7|The story presents conflicts on multiple levels—personal, interpersonal, and societal. These conflicts are interconnected, but the interpersonal dimension could be further developed for greater depth.\nCRITERION_7|Value Turns & Causal Cohesion|6|The narrative includes value shifts, such as the protagonist's decision to reveal the truth, but these shifts could be more cohesively linked through detailed causal chains to avoid abrupt transitions.\nCRITERION_8|Hierarchy of Beats & Midpoint/Climax Design|6|The story has a clear structure with escalating tension leading to a climax. However, the midpoint could be more distinct in changing the narrative's direction, and the climax could be more surprising.\nCRITERION_9|Emotional Punch & Aftershock|5|Key scenes, such as the public revelation, have emotional impact, but the aftershocks of these events could be more pronounced and explored in subsequent scenes to deepen the emotional resonance.\nCRITERION_10|Dual Resonance of Ending: Personal & Public|7|The ending addresses both personal and societal changes, with the protagonist finding inner balance and society reevaluating life values. However, the resolution could retain more ambiguity to reflect ongoing societal challenges.\n===EVALUATION_END===",
  "created_at": "2025-08-30T03:08:55.484338+00:00"
}