{
  "user_name": "赵炳熙822-2",
  "user_group": "writing_b2",
  "user_group_display": "写作 B-2",
  "submitted_text": "第一部分：故事概括\r\n在一个因永生药物而改变命运的世界中，主角通过对弟弟的嫉恨和自我无能的叹息，最终在弟弟因药物副作用崩溃前的独白和回忆中，发现了“塞翁失马焉知非福”的真理，接受了自己的独特价值。\r\n\r\n第二部分：第一幕\r\n故事开始于主角28岁时，永生药物的发现让他与弟弟的命运分道扬镳，弟弟因年龄合适而获得永生，主角则被排除在外，成为“迷失的一代”。在成长过程中，主角一直生活在弟弟的阴影下，嫉妒和自卑交织。激励事件发生在主角85岁时，永生药物的副作用被揭示，弟弟因无法入眠而精神崩溃，主角在看着被束缚住却还在试图撕咬挣扎的弟弟时，内心复杂地开始回忆。\r\n\r\n第三部分：第二幕\r\n主角在面对弟弟的痛苦时，内心的嫉恨和自我否定达到顶峰，他开始回忆两人共同经历的成长节点，从特长比赛到青梅竹马的选择，再到职业发展，弟弟的成功与自己的失落不断重现。随着弟弟的精神状态恶化，主角意识到自己一直以来的嫉妒是多么无谓，他开始尝试与弟弟和解，并在过程中发现自己的生活虽然没有永生，却充满了真实的幸福和成就。\r\n\r\n第四部分：第三幕\r\n在最终对决中，主角面对弟弟的痛苦，意识到自己无法真正帮助他，最终在医生递过来的安乐死文件上签署了自己的名字，长长地叹息，接受了自己的命运，理解了“塞翁失马焉知非福”的真理，世界也因他的改变而变得更加平衡。",
  "scores": {
    "Character Depth & Moral Dilemma Arc": 8,
    "Memory Anchors & Sensory Specificity": 7,
    "Intergenerational Span & Long-term Causality": 9,
    "Institutional & Tech Ethical Complexity": 5,
    "Investigative Drive & Clue Architecture": 4,
    "Multi-layered Conflict": 6,
    "Value Turns & Causal Cohesion": 8,
    "Hierarchy of Beats & Midpoint/Climax Design": 7,
    "Emotional Punch & Aftershock": 8,
    "Dual Resonance of Ending: Personal & Public": 6
  },
  "justifications": {
    "Character Depth & Moral Dilemma Arc": "The protagonist's journey from envy to acceptance is well-developed, with a clear initial desire to achieve what his brother has. The moral dilemma of signing the euthanasia papers for his brother adds depth, showcasing an irreversible internal transformation.",
    "Memory Anchors & Sensory Specificity": "The narrative uses memories of shared experiences to trigger emotional changes in the protagonist. While effective, the sensory details could be more vivid to enhance the emotional resonance.",
    "Intergenerational Span & Long-term Causality": "The story spans a significant timeline, contrasting the protagonist's life at 28 and 85, and effectively shows the long-term consequences of the life-extending drug on both brothers.",
    "Institutional & Tech Ethical Complexity": "The story touches on the ethical implications of the life-extending drug but lacks a detailed exploration of the institutional motives and complexities. The focus remains primarily on personal rather than institutional dynamics.",
    "Investigative Drive & Clue Architecture": "The narrative is not driven by an investigation or evidence-gathering plotline. The focus is more on personal reflection and emotional resolution rather than uncovering clues or building suspense.",
    "Multi-layered Conflict": "The story presents internal and interpersonal conflicts effectively, but lacks a strong extra-personal or institutional conflict layer. The protagonist's struggles are primarily internal and relational.",
    "Value Turns & Causal Cohesion": "The narrative features clear value shifts, such as envy to acceptance, and these shifts are causally linked through the protagonist's reflections and actions. The transitions are well-executed and coherent.",
    "Hierarchy of Beats & Midpoint/Climax Design": "The story follows a clear structure with a significant midpoint revelation about the drug's side effects, leading to a climax where the protagonist makes a pivotal decision. The escalation is consistent, though the climax could be more unexpected.",
    "Emotional Punch & Aftershock": "Key scenes, such as the protagonist's decision to sign the euthanasia papers, deliver strong emotional impact and have lasting effects on the narrative. The emotional journey is compelling and resonates throughout the story.",
    "Dual Resonance of Ending: Personal & Public": "The ending provides personal closure for the protagonist but lacks a broader societal or institutional resolution. The narrative hints at a more balanced world but does not fully explore the public implications of the protagonist's actions."
  },
  "metrics": [
    {
      "name": "Character Depth & Moral Dilemma Arc",
      "score": 8,
      "justification": "The protagonist's journey from envy to acceptance is well-developed, with a clear initial desire to achieve what his brother has. The moral dilemma of signing the euthanasia papers for his brother adds depth, showcasing an irreversible internal transformation."
    },
    {
      "name": "Memory Anchors & Sensory Specificity",
      "score": 7,
      "justification": "The narrative uses memories of shared experiences to trigger emotional changes in the protagonist. While effective, the sensory details could be more vivid to enhance the emotional resonance."
    },
    {
      "name": "Intergenerational Span & Long-term Causality",
      "score": 9,
      "justification": "The story spans a significant timeline, contrasting the protagonist's life at 28 and 85, and effectively shows the long-term consequences of the life-extending drug on both brothers."
    },
    {
      "name": "Institutional & Tech Ethical Complexity",
      "score": 5,
      "justification": "The story touches on the ethical implications of the life-extending drug but lacks a detailed exploration of the institutional motives and complexities. The focus remains primarily on personal rather than institutional dynamics."
    },
    {
      "name": "Investigative Drive & Clue Architecture",
      "score": 4,
      "justification": "The narrative is not driven by an investigation or evidence-gathering plotline. The focus is more on personal reflection and emotional resolution rather than uncovering clues or building suspense."
    },
    {
      "name": "Multi-layered Conflict",
      "score": 6,
      "justification": "The story presents internal and interpersonal conflicts effectively, but lacks a strong extra-personal or institutional conflict layer. The protagonist's struggles are primarily internal and relational."
    },
    {
      "name": "Value Turns & Causal Cohesion",
      "score": 8,
      "justification": "The narrative features clear value shifts, such as envy to acceptance, and these shifts are causally linked through the protagonist's reflections and actions. The transitions are well-executed and coherent."
    },
    {
      "name": "Hierarchy of Beats & Midpoint/Climax Design",
      "score": 7,
      "justification": "The story follows a clear structure with a significant midpoint revelation about the drug's side effects, leading to a climax where the protagonist makes a pivotal decision. The escalation is consistent, though the climax could be more unexpected."
    },
    {
      "name": "Emotional Punch & Aftershock",
      "score": 8,
      "justification": "Key scenes, such as the protagonist's decision to sign the euthanasia papers, deliver strong emotional impact and have lasting effects on the narrative. The emotional journey is compelling and resonates throughout the story."
    },
    {
      "name": "Dual Resonance of Ending: Personal & Public",
      "score": 6,
      "justification": "The ending provides personal closure for the protagonist but lacks a broader societal or institutional resolution. The narrative hints at a more balanced world but does not fully explore the public implications of the protagonist's actions."
    }
  ],
  "overall_summary": "The narrative explores the profound themes of envy, self-worth, and acceptance in a world altered by a life-extending drug. The protagonist's journey from jealousy to acceptance is well-articulated, with a strong focus on internal transformation and moral dilemmas. The story effectively uses intergenerational timelines and memory anchors to deepen the emotional impact, though it could benefit from more complex institutional dynamics and layered conflicts.",
  "total_score": 68,
  "ai_response": "===EVALUATION_START===\nOVERALL_SUMMARY: The narrative explores the profound themes of envy, self-worth, and acceptance in a world altered by a life-extending drug. The protagonist's journey from jealousy to acceptance is well-articulated, with a strong focus on internal transformation and moral dilemmas. The story effectively uses intergenerational timelines and memory anchors to deepen the emotional impact, though it could benefit from more complex institutional dynamics and layered conflicts.\n\nCRITERION_SCORES:\nCRITERION_1|Character Depth & Moral Dilemma Arc|8|The protagonist's journey from envy to acceptance is well-developed, with a clear initial desire to achieve what his brother has. The moral dilemma of signing the euthanasia papers for his brother adds depth, showcasing an irreversible internal transformation.\nCRITERION_2|Memory Anchors & Sensory Specificity|7|The narrative uses memories of shared experiences to trigger emotional changes in the protagonist. While effective, the sensory details could be more vivid to enhance the emotional resonance.\nCRITERION_3|Intergenerational Span & Long-term Causality|9|The story spans a significant timeline, contrasting the protagonist's life at 28 and 85, and effectively shows the long-term consequences of the life-extending drug on both brothers.\nCRITERION_4|Institutional & Tech Ethical Complexity|5|The story touches on the ethical implications of the life-extending drug but lacks a detailed exploration of the institutional motives and complexities. The focus remains primarily on personal rather than institutional dynamics.\nCRITERION_5|Investigative Drive & Clue Architecture|4|The narrative is not driven by an investigation or evidence-gathering plotline. The focus is more on personal reflection and emotional resolution rather than uncovering clues or building suspense.\nCRITERION_6|Multi-layered Conflict|6|The story presents internal and interpersonal conflicts effectively, but lacks a strong extra-personal or institutional conflict layer. The protagonist's struggles are primarily internal and relational.\nCRITERION_7|Value Turns & Causal Cohesion|8|The narrative features clear value shifts, such as envy to acceptance, and these shifts are causally linked through the protagonist's reflections and actions. The transitions are well-executed and coherent.\nCRITERION_8|Hierarchy of Beats & Midpoint/Climax Design|7|The story follows a clear structure with a significant midpoint revelation about the drug's side effects, leading to a climax where the protagonist makes a pivotal decision. The escalation is consistent, though the climax could be more unexpected.\nCRITERION_9|Emotional Punch & Aftershock|8|Key scenes, such as the protagonist's decision to sign the euthanasia papers, deliver strong emotional impact and have lasting effects on the narrative. The emotional journey is compelling and resonates throughout the story.\nCRITERION_10|Dual Resonance of Ending: Personal & Public|6|The ending provides personal closure for the protagonist but lacks a broader societal or institutional resolution. The narrative hints at a more balanced world but does not fully explore the public implications of the protagonist's actions.\n===EVALUATION_END===",
  "created_at": "2025-08-28T13:15:46.697278+00:00"
}