{
  "user_name": "test4",
  "user_group": "writing_b1",
  "user_group_display": "写作 B-1",
  "submitted_text": "第一部分：故事概括\r\n在一个永生药物改变人类命运的世界中，一位被排除在外的“迷失的一代”成员在85岁时发现药物的致命副作用，他在揭露真相的过程中，面临着保护自己享受永生药物的后代的艰难选择，最终揭示出人性复杂却充满希望的本质。\r\n\r\n第二部分：第一幕\r\n故事开始于主角28岁时，科学家宣布发现一种可以阻止衰老的药物，政府决定只提供给26岁以下的公民，主角和他的同龄人被称为“迷失的一代”，被排除在外。随着时间的推移，主角目睹自己的孩子享受永生的特权，而他自己则逐渐老去，心中充满不甘与失落。当他85岁时，主角偶然发现永生药物的副作用正在悄然显现，威胁着所有使用者的生命。\r\n\r\n第三部分：第二幕\r\n主角开始调查药物的真相，发现政府早已知晓副作用却选择隐瞒，为了保护自己的利益。随着调查的深入，他结识了一群同样被排除在外的“迷失的一代”成员，他们决定联手揭露真相。在这个过程中，主角面临来自政府的威胁和内心的挣扎，他必须在揭露真相和保护自己享受永生药物的后代之间做出艰难选择。随着时间的推移，药物的副作用愈发明显，社会开始动荡不安，而他的后代也因担心而与他产生冲突，但最终选择支持他的决定。\r\n\r\n第四部分：第三幕\r\n在最终对决中，主角和他的盟友们成功揭露了药物的真相，迫使政府公开承认错误并停止药物的分发。已经使用药物的人面临着逐渐失去永生效果的恐慌和健康问题的威胁，社会陷入混乱。尽管这一胜利来之不易，但主角意识到人类对永生的追求终究无法逃避自然规律。他选择回归平凡的生活，珍惜有限的时光，与家人和朋友共度余生。主角与后代在经历了风雨后更加珍惜彼此，故事以主角的内心平和结束，展现出在复杂的人性中仍然存在希望与爱的力量。",
  "scores": {
    "Character Depth & Moral Dilemma Arc": 8,
    "Memory Anchors & Sensory Specificity": 5,
    "Intergenerational Span & Long-term Causality": 9,
    "Institutional & Tech Ethical Complexity": 7,
    "Investigative Drive & Clue Architecture": 6,
    "Multi-layered Conflict": 8,
    "Value Turns & Causal Cohesion": 7,
    "Hierarchy of Beats & Midpoint/Climax Design": 7,
    "Emotional Punch & Aftershock": 8,
    "Dual Resonance of Ending: Personal & Public": 9
  },
  "justifications": {
    "Character Depth & Moral Dilemma Arc": "The protagonist's moral dilemma is well-developed, as he must choose between revealing the truth about the drug's side effects and protecting his descendants who benefit from it. His internal transformation is evident as he moves from resentment to acceptance and reconciliation.",
    "Memory Anchors & Sensory Specificity": "While the narrative mentions the protagonist's observations of his children enjoying eternal life, it lacks specific sensory details or recurring memory anchors that drive plot progression or character decisions.",
    "Intergenerational Span & Long-term Causality": "The story effectively uses intergenerational dynamics, contrasting the protagonist's aging with his children's eternal youth, and explores long-term consequences of the government's decisions on different generations.",
    "Institutional & Tech Ethical Complexity": "The narrative presents the government as a complex entity with motives of self-interest and fear, but could benefit from more detailed institutional evidence like documents or media clips to enhance ethical complexity.",
    "Investigative Drive & Clue Architecture": "The investigation into the drug's side effects drives the plot, but lacks detailed clue architecture and rising costs associated with evidence gathering, which could enhance suspense and rhythm.",
    "Multi-layered Conflict": "The story features internal, interpersonal, and institutional conflicts, with the protagonist's personal struggles, family tensions, and societal upheaval all interconnected, pushing him to an extreme test.",
    "Value Turns & Causal Cohesion": "The narrative includes clear value shifts, such as trust to suspicion and chaos in society, with causal links between scenes. However, some transitions could be more explicitly connected to avoid seeming coincidental.",
    "Hierarchy of Beats & Midpoint/Climax Design": "The story has a clear structure with escalating pressure, and the climax delivers an irreversible turn. However, the midpoint could more dramatically change the narrative's direction to enhance impact.",
    "Emotional Punch & Aftershock": "Key scenes, such as the protagonist's decision to expose the truth, have strong emotional impact and resonate throughout the story, affecting relationships and societal dynamics.",
    "Dual Resonance of Ending: Personal & Public": "The ending addresses both personal and societal issues, with the protagonist finding peace and the institution facing public backlash. It maintains moral ambiguity, avoiding simplistic resolutions."
  },
  "metrics": [
    {
      "name": "Character Depth & Moral Dilemma Arc",
      "score": 8,
      "justification": "The protagonist's moral dilemma is well-developed, as he must choose between revealing the truth about the drug's side effects and protecting his descendants who benefit from it. His internal transformation is evident as he moves from resentment to acceptance and reconciliation."
    },
    {
      "name": "Memory Anchors & Sensory Specificity",
      "score": 5,
      "justification": "While the narrative mentions the protagonist's observations of his children enjoying eternal life, it lacks specific sensory details or recurring memory anchors that drive plot progression or character decisions."
    },
    {
      "name": "Intergenerational Span & Long-term Causality",
      "score": 9,
      "justification": "The story effectively uses intergenerational dynamics, contrasting the protagonist's aging with his children's eternal youth, and explores long-term consequences of the government's decisions on different generations."
    },
    {
      "name": "Institutional & Tech Ethical Complexity",
      "score": 7,
      "justification": "The narrative presents the government as a complex entity with motives of self-interest and fear, but could benefit from more detailed institutional evidence like documents or media clips to enhance ethical complexity."
    },
    {
      "name": "Investigative Drive & Clue Architecture",
      "score": 6,
      "justification": "The investigation into the drug's side effects drives the plot, but lacks detailed clue architecture and rising costs associated with evidence gathering, which could enhance suspense and rhythm."
    },
    {
      "name": "Multi-layered Conflict",
      "score": 8,
      "justification": "The story features internal, interpersonal, and institutional conflicts, with the protagonist's personal struggles, family tensions, and societal upheaval all interconnected, pushing him to an extreme test."
    },
    {
      "name": "Value Turns & Causal Cohesion",
      "score": 7,
      "justification": "The narrative includes clear value shifts, such as trust to suspicion and chaos in society, with causal links between scenes. However, some transitions could be more explicitly connected to avoid seeming coincidental."
    },
    {
      "name": "Hierarchy of Beats & Midpoint/Climax Design",
      "score": 7,
      "justification": "The story has a clear structure with escalating pressure, and the climax delivers an irreversible turn. However, the midpoint could more dramatically change the narrative's direction to enhance impact."
    },
    {
      "name": "Emotional Punch & Aftershock",
      "score": 8,
      "justification": "Key scenes, such as the protagonist's decision to expose the truth, have strong emotional impact and resonate throughout the story, affecting relationships and societal dynamics."
    },
    {
      "name": "Dual Resonance of Ending: Personal & Public",
      "score": 9,
      "justification": "The ending addresses both personal and societal issues, with the protagonist finding peace and the institution facing public backlash. It maintains moral ambiguity, avoiding simplistic resolutions."
    }
  ],
  "overall_summary": "The narrative presents a compelling story set in a world where a drug promises eternal life but comes with hidden consequences. The protagonist, part of a \"lost generation\" excluded from the benefits, faces a moral dilemma between exposing the truth and protecting his descendants. The story explores themes of human complexity and hope, with intergenerational conflict and institutional deceit.",
  "total_score": 74,
  "ai_response": "===EVALUATION_START===\nOVERALL_SUMMARY: The narrative presents a compelling story set in a world where a drug promises eternal life but comes with hidden consequences. The protagonist, part of a \"lost generation\" excluded from the benefits, faces a moral dilemma between exposing the truth and protecting his descendants. The story explores themes of human complexity and hope, with intergenerational conflict and institutional deceit.\n\nCRITERION_SCORES:\nCRITERION_1|Character Depth & Moral Dilemma Arc|8|The protagonist's moral dilemma is well-developed, as he must choose between revealing the truth about the drug's side effects and protecting his descendants who benefit from it. His internal transformation is evident as he moves from resentment to acceptance and reconciliation.\nCRITERION_2|Memory Anchors & Sensory Specificity|5|While the narrative mentions the protagonist's observations of his children enjoying eternal life, it lacks specific sensory details or recurring memory anchors that drive plot progression or character decisions.\nCRITERION_3|Intergenerational Span & Long-term Causality|9|The story effectively uses intergenerational dynamics, contrasting the protagonist's aging with his children's eternal youth, and explores long-term consequences of the government's decisions on different generations.\nCRITERION_4|Institutional & Tech Ethical Complexity|7|The narrative presents the government as a complex entity with motives of self-interest and fear, but could benefit from more detailed institutional evidence like documents or media clips to enhance ethical complexity.\nCRITERION_5|Investigative Drive & Clue Architecture|6|The investigation into the drug's side effects drives the plot, but lacks detailed clue architecture and rising costs associated with evidence gathering, which could enhance suspense and rhythm.\nCRITERION_6|Multi-layered Conflict|8|The story features internal, interpersonal, and institutional conflicts, with the protagonist's personal struggles, family tensions, and societal upheaval all interconnected, pushing him to an extreme test.\nCRITERION_7|Value Turns & Causal Cohesion|7|The narrative includes clear value shifts, such as trust to suspicion and chaos in society, with causal links between scenes. However, some transitions could be more explicitly connected to avoid seeming coincidental.\nCRITERION_8|Hierarchy of Beats & Midpoint/Climax Design|7|The story has a clear structure with escalating pressure, and the climax delivers an irreversible turn. However, the midpoint could more dramatically change the narrative's direction to enhance impact.\nCRITERION_9|Emotional Punch & Aftershock|8|Key scenes, such as the protagonist's decision to expose the truth, have strong emotional impact and resonate throughout the story, affecting relationships and societal dynamics.\nCRITERION_10|Dual Resonance of Ending: Personal & Public|9|The ending addresses both personal and societal issues, with the protagonist finding peace and the institution facing public backlash. It maintains moral ambiguity, avoiding simplistic resolutions.\n===EVALUATION_END===",
  "created_at": "2025-08-28T14:15:52.614161+00:00"
}