{
  "user_name": "0901zbx",
  "user_group": "writing_b2",
  "user_group_display": "写作 B-2",
  "submitted_text": "第一部分：故事概括\r\n\r\n在一个因永生药物引发社会不平等的未来，85岁的主角揭露药物的致命副作用，挑战不公制度，唤醒被遗忘的“迷失的一代”，最终推动社会变革，呼唤人们重新审视生命的真正价值。\r\n第二部分：第一幕\r\n\r\n故事开始于主角28岁时，科学界宣布发现一种能阻止衰老的药物，但政府只将其提供给26岁以下的公民，主角和“迷失的一代”被排除在外。面对教育、医疗、住房等方面的巨大压力，政府推出永生药物作为缓解社会矛盾的解决方案，然而，主角心怀不满却无能为力，只能看着年轻一代享受永生的特权。随着时间推移，主角逐渐接受了自己的命运，直到85岁时，药物的副作用开始显现，年轻一代的健康状况急剧恶化，社会陷入恐慌。\r\n第三部分：第二幕\r\n\r\n主角意识到这是揭露真相的机会，他开始调查药物的真实影响，并与其他“迷失的一代”成员联手，收集证据。随着调查深入，主角发现政府和制药公司早已知晓副作用，却选择隐瞒真相以维持权力和利益。药物的副作用不仅导致身体机能的崩溃，还引发了严重的心理问题，年轻一代的精神状态逐渐恶化。主角面临内心的挣扎，是否要冒险揭露真相，最终在一次公共演讲中，他勇敢地揭示了药物的危害，引发社会的广泛关注和抗议。\r\n第四部分：第三幕\r\n\r\n在社会动荡中，主角和他的盟友们面临来自政府和制药公司的强烈反击，但他们坚定不移，继续推动真相的传播。最终，随着越来越多的证据曝光，政府被迫承认错误，停止药物的分发，并开始研究解决方案。主角在这一过程中找到了内心的平衡，虽然无法获得永生，但他通过自己的努力改变了社会的不公，迎来了一个更加公平的未来。结尾处，人们开始反思生命的意义，意识到真正的永生在于对生命价值的理解和珍惜。",
  "scores": {
    "Character Depth & Moral Dilemma Arc": 8,
    "Memory Anchors & Sensory Specificity": 5,
    "Intergenerational Span & Long-term Causality": 9,
    "Institutional & Tech Ethical Complexity": 7,
    "Investigative Drive & Clue Architecture": 8,
    "Multi-layered Conflict": 7,
    "Value Turns & Causal Cohesion": 8,
    "Hierarchy of Beats & Midpoint/Climax Design": 7,
    "Emotional Punch & Aftershock": 6,
    "Dual Resonance of Ending: Personal & Public": 8
  },
  "justifications": {
    "Character Depth & Moral Dilemma Arc": "The protagonist undergoes significant internal transformation, moving from resignation to active resistance. His moral dilemma—whether to reveal the truth at great personal risk—is well-developed, though the internal reasoning could be more explicitly detailed.",
    "Memory Anchors & Sensory Specificity": "While the narrative hints at past experiences influencing the protagonist's actions, it lacks specific sensory details or recurring memory anchors that could enhance emotional depth and plot progression.",
    "Intergenerational Span & Long-term Causality": "The story effectively uses an intergenerational timeline, contrasting the protagonist's youth with his elderly perspective. The long-term consequences of the drug's distribution are clearly depicted, impacting both personal and societal levels.",
    "Institutional & Tech Ethical Complexity": "The narrative presents a multifaceted view of government and corporate interests, though the institutions could be depicted with more complexity and nuance to avoid a purely villainous portrayal.",
    "Investigative Drive & Clue Architecture": "The protagonist's investigation into the drug's effects is a central plotline, with evidence gathering driving the narrative forward. The risks and costs associated with this investigation are well-portrayed, creating suspense.",
    "Multi-layered Conflict": "The story includes internal, interpersonal, and extra-personal conflicts, though these could be more intricately woven together to amplify the protagonist's challenges and the narrative tension.",
    "Value Turns & Causal Cohesion": "Each scene brings clear value shifts, such as from ignorance to awareness and from resignation to activism. These shifts are logically connected, though some transitions could be more deeply explored.",
    "Hierarchy of Beats & Midpoint/Climax Design": "The narrative structure is clear, with a significant midpoint where the protagonist decides to expose the truth. The climax is impactful, though the escalation of stakes could be more pronounced.",
    "Emotional Punch & Aftershock": "Key scenes, such as the public revelation of the drug's effects, have emotional impact, but the aftershocks could be more extensively explored to deepen the narrative's emotional resonance.",
    "Dual Resonance of Ending: Personal & Public": "The ending effectively addresses both personal and societal levels, with the protagonist finding inner peace and society beginning to reflect on life's true value. However, the resolution could benefit from more ambiguity and complexity."
  },
  "metrics": [
    {
      "name": "Character Depth & Moral Dilemma Arc",
      "score": 8,
      "justification": "The protagonist undergoes significant internal transformation, moving from resignation to active resistance. His moral dilemma—whether to reveal the truth at great personal risk—is well-developed, though the internal reasoning could be more explicitly detailed."
    },
    {
      "name": "Memory Anchors & Sensory Specificity",
      "score": 5,
      "justification": "While the narrative hints at past experiences influencing the protagonist's actions, it lacks specific sensory details or recurring memory anchors that could enhance emotional depth and plot progression."
    },
    {
      "name": "Intergenerational Span & Long-term Causality",
      "score": 9,
      "justification": "The story effectively uses an intergenerational timeline, contrasting the protagonist's youth with his elderly perspective. The long-term consequences of the drug's distribution are clearly depicted, impacting both personal and societal levels."
    },
    {
      "name": "Institutional & Tech Ethical Complexity",
      "score": 7,
      "justification": "The narrative presents a multifaceted view of government and corporate interests, though the institutions could be depicted with more complexity and nuance to avoid a purely villainous portrayal."
    },
    {
      "name": "Investigative Drive & Clue Architecture",
      "score": 8,
      "justification": "The protagonist's investigation into the drug's effects is a central plotline, with evidence gathering driving the narrative forward. The risks and costs associated with this investigation are well-portrayed, creating suspense."
    },
    {
      "name": "Multi-layered Conflict",
      "score": 7,
      "justification": "The story includes internal, interpersonal, and extra-personal conflicts, though these could be more intricately woven together to amplify the protagonist's challenges and the narrative tension."
    },
    {
      "name": "Value Turns & Causal Cohesion",
      "score": 8,
      "justification": "Each scene brings clear value shifts, such as from ignorance to awareness and from resignation to activism. These shifts are logically connected, though some transitions could be more deeply explored."
    },
    {
      "name": "Hierarchy of Beats & Midpoint/Climax Design",
      "score": 7,
      "justification": "The narrative structure is clear, with a significant midpoint where the protagonist decides to expose the truth. The climax is impactful, though the escalation of stakes could be more pronounced."
    },
    {
      "name": "Emotional Punch & Aftershock",
      "score": 6,
      "justification": "Key scenes, such as the public revelation of the drug's effects, have emotional impact, but the aftershocks could be more extensively explored to deepen the narrative's emotional resonance."
    },
    {
      "name": "Dual Resonance of Ending: Personal & Public",
      "score": 8,
      "justification": "The ending effectively addresses both personal and societal levels, with the protagonist finding inner peace and society beginning to reflect on life's true value. However, the resolution could benefit from more ambiguity and complexity."
    }
  ],
  "overall_summary": "The narrative presents a compelling story set in a dystopian future where a drug promising immortality creates societal inequality. The protagonist, initially resigned to his fate, becomes a catalyst for change by exposing the drug's fatal side effects. The story effectively explores themes of morality, societal injustice, and the true value of life, though some areas could benefit from deeper exploration and complexity.",
  "total_score": 73,
  "ai_response": "===EVALUATION_START===\nOVERALL_SUMMARY: The narrative presents a compelling story set in a dystopian future where a drug promising immortality creates societal inequality. The protagonist, initially resigned to his fate, becomes a catalyst for change by exposing the drug's fatal side effects. The story effectively explores themes of morality, societal injustice, and the true value of life, though some areas could benefit from deeper exploration and complexity.\n\nCRITERION_SCORES:\nCRITERION_1|Character Depth & Moral Dilemma Arc|8|The protagonist undergoes significant internal transformation, moving from resignation to active resistance. His moral dilemma—whether to reveal the truth at great personal risk—is well-developed, though the internal reasoning could be more explicitly detailed.\nCRITERION_2|Memory Anchors & Sensory Specificity|5|While the narrative hints at past experiences influencing the protagonist's actions, it lacks specific sensory details or recurring memory anchors that could enhance emotional depth and plot progression.\nCRITERION_3|Intergenerational Span & Long-term Causality|9|The story effectively uses an intergenerational timeline, contrasting the protagonist's youth with his elderly perspective. The long-term consequences of the drug's distribution are clearly depicted, impacting both personal and societal levels.\nCRITERION_4|Institutional & Tech Ethical Complexity|7|The narrative presents a multifaceted view of government and corporate interests, though the institutions could be depicted with more complexity and nuance to avoid a purely villainous portrayal.\nCRITERION_5|Investigative Drive & Clue Architecture|8|The protagonist's investigation into the drug's effects is a central plotline, with evidence gathering driving the narrative forward. The risks and costs associated with this investigation are well-portrayed, creating suspense.\nCRITERION_6|Multi-layered Conflict|7|The story includes internal, interpersonal, and extra-personal conflicts, though these could be more intricately woven together to amplify the protagonist's challenges and the narrative tension.\nCRITERION_7|Value Turns & Causal Cohesion|8|Each scene brings clear value shifts, such as from ignorance to awareness and from resignation to activism. These shifts are logically connected, though some transitions could be more deeply explored.\nCRITERION_8|Hierarchy of Beats & Midpoint/Climax Design|7|The narrative structure is clear, with a significant midpoint where the protagonist decides to expose the truth. The climax is impactful, though the escalation of stakes could be more pronounced.\nCRITERION_9|Emotional Punch & Aftershock|6|Key scenes, such as the public revelation of the drug's effects, have emotional impact, but the aftershocks could be more extensively explored to deepen the narrative's emotional resonance.\nCRITERION_10|Dual Resonance of Ending: Personal & Public|8|The ending effectively addresses both personal and societal levels, with the protagonist finding inner peace and society beginning to reflect on life's true value. However, the resolution could benefit from more ambiguity and complexity.\n===EVALUATION_END===",
  "created_at": "2025-09-01T01:43:32.008577+00:00"
}