{
  "user_name": "2-exp",
  "user_group": "writing_b2",
  "user_group_display": "写作 B-2",
  "submitted_text": "第一部分：故事概括\r\n在一个永生药物改变人类命运的世界中，一位被排除在外的“迷失的一代”成员在85岁时发现药物的致命副作用，他在揭露真相的过程中，面临着保护自己享受永生药物的后代的艰难选择，最终揭示出人性复杂却充满希望的本质。\r\n\r\n第二部分：第一幕\r\n故事开始于主角28岁时，科学家宣布发现一种可以阻止衰老的药物，政府决定只提供给26岁以下的公民，主角和他的同龄人被称为“迷失的一代”，被排除在外。随着时间的推移，主角目睹自己的孩子享受永生的特权，而他自己则逐渐老去，心中充满不甘与失落。当他85岁时，主角偶然发现永生药物的副作用正在悄然显现，威胁着所有使用者的生命。\r\n\r\n第三部分：第二幕\r\n主角开始调查药物的真相，发现政府早已知晓副作用却选择隐瞒，为了保护自己的利益。随着调查的深入，他结识了一群同样被排除在外的“迷失的一代”成员，他们决定联手揭露真相。在这个过程中，主角面临来自政府的威胁和内心的挣扎，他必须在揭露真相和保护自己享受永生药物的后代之间做出艰难选择。随着时间的推移，药物的副作用愈发明显，社会开始动荡不安，而他的后代也因担心而与他产生冲突，但最终选择支持他的决定。\r\n\r\n第四部分：第三幕\r\n在最终对决中，主角和他的盟友们成功揭露了药物的真相，迫使政府公开承认错误并停止药物的分发。已经使用药物的人面临着逐渐失去永生效果的恐慌和健康问题的威胁，社会陷入混乱。尽管这一胜利来之不易，但主角意识到人类对永生的追求终究无法逃避自然规律。他选择回归平凡的生活，珍惜有限的时光，与家人和朋友共度余生。主角与后代在经历了风雨后更加珍惜彼此，故事以主角的内心平和结束，展现出在复杂的人性中仍然存在希望与爱的力量。",
  "scores": {
    "Character Depth & Moral Dilemma Arc": 8,
    "Memory Anchors & Sensory Specificity": 6,
    "Intergenerational Span & Long-term Causality": 9,
    "Institutional & Tech Ethical Complexity": 8,
    "Investigative Drive & Clue Architecture": 7,
    "Multi-layered Conflict": 8,
    "Value Turns & Causal Cohesion": 7,
    "Hierarchy of Beats & Midpoint/Climax Design": 8,
    "Emotional Punch & Aftershock": 7,
    "Dual Resonance of Ending: Personal & Public": 9
  },
  "justifications": {
    "Character Depth & Moral Dilemma Arc": "The protagonist faces a profound moral dilemma between exposing the truth and protecting his descendants. His journey from exclusion to revelation demonstrates significant internal transformation, supported by his evolving relationship with his children.",
    "Memory Anchors & Sensory Specificity": "While the narrative mentions the protagonist's aging and his children's privilege, sensory details and recurring memory anchors are less emphasized, limiting their causal role in plot progression.",
    "Intergenerational Span & Long-term Causality": "The story effectively uses intergenerational dynamics, contrasting the protagonist's aging with his children's eternal youth, and explores long-term consequences of early decisions, such as societal exclusion and eventual support from his descendants.",
    "Institutional & Tech Ethical Complexity": "The government is depicted with multifaceted motives, balancing self-interest and ethical neglect. The protagonist's fate is directly linked to institutional actions, creating a complex ethical landscape.",
    "Investigative Drive & Clue Architecture": "The protagonist's investigation is central to the plot, with layered clues revealing government deception. The narrative maintains suspense, though the rhythm of clue discovery could be more pronounced.",
    "Multi-layered Conflict": "Conflicts are present on internal, interpersonal, and institutional levels, with the protagonist's personal struggles amplifying societal tensions. The diverse antagonistic forces enhance the narrative's complexity.",
    "Value Turns & Causal Cohesion": "The narrative includes clear value shifts, such as trust turning to suspicion, and these shifts are causally linked to the protagonist's actions. However, some transitions could benefit from deeper exploration.",
    "Hierarchy of Beats & Midpoint/Climax Design": "The story structure is well-defined, with a midpoint revealing the drug's side effects and a climax forcing government accountability. The irreversible societal change adds depth to the climax.",
    "Emotional Punch & Aftershock": "Key scenes, such as the protagonist's decision to reveal the truth, deliver emotional impact. These emotions resonate throughout the narrative, though some aftershocks could be more deeply integrated.",
    "Dual Resonance of Ending: Personal & Public": "The ending addresses both personal reconciliation and societal upheaval, maintaining moral ambiguity. The protagonist's return to a normal life alongside public chaos reflects a nuanced resolution."
  },
  "metrics": [
    {
      "name": "Character Depth & Moral Dilemma Arc",
      "score": 8,
      "justification": "The protagonist faces a profound moral dilemma between exposing the truth and protecting his descendants. His journey from exclusion to revelation demonstrates significant internal transformation, supported by his evolving relationship with his children."
    },
    {
      "name": "Memory Anchors & Sensory Specificity",
      "score": 6,
      "justification": "While the narrative mentions the protagonist's aging and his children's privilege, sensory details and recurring memory anchors are less emphasized, limiting their causal role in plot progression."
    },
    {
      "name": "Intergenerational Span & Long-term Causality",
      "score": 9,
      "justification": "The story effectively uses intergenerational dynamics, contrasting the protagonist's aging with his children's eternal youth, and explores long-term consequences of early decisions, such as societal exclusion and eventual support from his descendants."
    },
    {
      "name": "Institutional & Tech Ethical Complexity",
      "score": 8,
      "justification": "The government is depicted with multifaceted motives, balancing self-interest and ethical neglect. The protagonist's fate is directly linked to institutional actions, creating a complex ethical landscape."
    },
    {
      "name": "Investigative Drive & Clue Architecture",
      "score": 7,
      "justification": "The protagonist's investigation is central to the plot, with layered clues revealing government deception. The narrative maintains suspense, though the rhythm of clue discovery could be more pronounced."
    },
    {
      "name": "Multi-layered Conflict",
      "score": 8,
      "justification": "Conflicts are present on internal, interpersonal, and institutional levels, with the protagonist's personal struggles amplifying societal tensions. The diverse antagonistic forces enhance the narrative's complexity."
    },
    {
      "name": "Value Turns & Causal Cohesion",
      "score": 7,
      "justification": "The narrative includes clear value shifts, such as trust turning to suspicion, and these shifts are causally linked to the protagonist's actions. However, some transitions could benefit from deeper exploration."
    },
    {
      "name": "Hierarchy of Beats & Midpoint/Climax Design",
      "score": 8,
      "justification": "The story structure is well-defined, with a midpoint revealing the drug's side effects and a climax forcing government accountability. The irreversible societal change adds depth to the climax."
    },
    {
      "name": "Emotional Punch & Aftershock",
      "score": 7,
      "justification": "Key scenes, such as the protagonist's decision to reveal the truth, deliver emotional impact. These emotions resonate throughout the narrative, though some aftershocks could be more deeply integrated."
    },
    {
      "name": "Dual Resonance of Ending: Personal & Public",
      "score": 9,
      "justification": "The ending addresses both personal reconciliation and societal upheaval, maintaining moral ambiguity. The protagonist's return to a normal life alongside public chaos reflects a nuanced resolution."
    }
  ],
  "overall_summary": "The narrative explores a futuristic world where a drug promises eternal life but comes with hidden consequences. The protagonist, part of a generation excluded from this privilege, faces moral dilemmas and institutional opposition as he uncovers the truth. The story effectively intertwines personal and societal conflicts, culminating in a resolution that highlights the complexity and hope within human nature.",
  "total_score": 77,
  "ai_response": "===EVALUATION_START===\nOVERALL_SUMMARY: The narrative explores a futuristic world where a drug promises eternal life but comes with hidden consequences. The protagonist, part of a generation excluded from this privilege, faces moral dilemmas and institutional opposition as he uncovers the truth. The story effectively intertwines personal and societal conflicts, culminating in a resolution that highlights the complexity and hope within human nature.\n\nCRITERION_SCORES:\nCRITERION_1|Character Depth & Moral Dilemma Arc|8|The protagonist faces a profound moral dilemma between exposing the truth and protecting his descendants. His journey from exclusion to revelation demonstrates significant internal transformation, supported by his evolving relationship with his children.\nCRITERION_2|Memory Anchors & Sensory Specificity|6|While the narrative mentions the protagonist's aging and his children's privilege, sensory details and recurring memory anchors are less emphasized, limiting their causal role in plot progression.\nCRITERION_3|Intergenerational Span & Long-term Causality|9|The story effectively uses intergenerational dynamics, contrasting the protagonist's aging with his children's eternal youth, and explores long-term consequences of early decisions, such as societal exclusion and eventual support from his descendants.\nCRITERION_4|Institutional & Tech Ethical Complexity|8|The government is depicted with multifaceted motives, balancing self-interest and ethical neglect. The protagonist's fate is directly linked to institutional actions, creating a complex ethical landscape.\nCRITERION_5|Investigative Drive & Clue Architecture|7|The protagonist's investigation is central to the plot, with layered clues revealing government deception. The narrative maintains suspense, though the rhythm of clue discovery could be more pronounced.\nCRITERION_6|Multi-layered Conflict|8|Conflicts are present on internal, interpersonal, and institutional levels, with the protagonist's personal struggles amplifying societal tensions. The diverse antagonistic forces enhance the narrative's complexity.\nCRITERION_7|Value Turns & Causal Cohesion|7|The narrative includes clear value shifts, such as trust turning to suspicion, and these shifts are causally linked to the protagonist's actions. However, some transitions could benefit from deeper exploration.\nCRITERION_8|Hierarchy of Beats & Midpoint/Climax Design|8|The story structure is well-defined, with a midpoint revealing the drug's side effects and a climax forcing government accountability. The irreversible societal change adds depth to the climax.\nCRITERION_9|Emotional Punch & Aftershock|7|Key scenes, such as the protagonist's decision to reveal the truth, deliver emotional impact. These emotions resonate throughout the narrative, though some aftershocks could be more deeply integrated.\nCRITERION_10|Dual Resonance of Ending: Personal & Public|9|The ending addresses both personal reconciliation and societal upheaval, maintaining moral ambiguity. The protagonist's return to a normal life alongside public chaos reflects a nuanced resolution.\n===EVALUATION_END===",
  "created_at": "2025-08-28T13:02:30.321088+00:00"
}