{
  "user_name": "zbx",
  "user_group": "writing_b1",
  "user_group_display": "写作 B-1",
  "submitted_text": "第一部分：故事概括\r\n在人类几乎灭绝后，幸存者发现古老的魔法力量重新觉醒，他们必须团结起来对抗强大的外星入侵者，通过探索神秘山洞破解古老秘密，重新定义人类的未来。\r\n\r\n第二部分：第一幕\r\n在一个曾经充满魔法的世界里，人类因人口暴增而失去魔力，变成了无力的麻瓜。随着外星人入侵并大规模屠杀人类，幸存者们发现自己体内的魔法力量开始苏醒。面对新的威胁，主角最初对这股力量感到恐惧和怀疑，但在目睹亲友的牺牲后，他决定探索这股力量的来源和潜力，并在寻找食物的途中意外进入一个神秘山洞，发现古老的神迹字体。\r\n\r\n第三部分：第二幕\r\n主角和其他幸存者开始团结起来，试图理解并掌握重新觉醒的魔法力量，他们遇到了来自不同背景的盟友和敌人。在探索神秘山洞时，他们几乎陷入绝望，但通过不懈努力破解了部分古老秘密，获得了新的洞察力和力量。在一次小胜利后，他们发现外星人正在计划更大规模的攻击，随着冲突的加剧，主角面临内心的挣扎，质疑自己的能力和领导力。在至暗时刻，主角几乎失去所有希望，但通过关键发现，他获得了新的洞察力，准备迎接最终的挑战。\r\n\r\n第四部分：第三幕\r\n主角和幸存者们制定了一个大胆的计划，准备与外星人进行最后的对决。在高潮时刻，主角运用所学的魔法力量，面对最大的挑战，并做出了一个体现人类团结和勇气的选择。随着外星人被击退，人类重新获得了对地球的控制，主角和幸存者们开始重建一个新的世界，展现出人类和魔法力量的新的平衡。",
  "scores": {
    "Character Depth & Moral Dilemma Arc": 5,
    "Memory Anchors & Sensory Specificity": 4,
    "Intergenerational Span & Long-term Causality": 3,
    "Institutional & Tech Ethical Complexity": 3,
    "Investigative Drive & Clue Architecture": 5,
    "Multi-layered Conflict": 6,
    "Value Turns & Causal Cohesion": 5,
    "Hierarchy of Beats & Midpoint/Climax Design": 6,
    "Emotional Punch & Aftershock": 5,
    "Dual Resonance of Ending: Personal & Public": 6
  },
  "justifications": {
    "Character Depth & Moral Dilemma Arc": "The protagonist's internal struggle is evident, particularly in his fear and eventual acceptance of magic. However, the moral dilemma is not deeply explored, as the choice to fight is straightforward and lacks complexity. The transformation is more situational than internal.",
    "Memory Anchors & Sensory Specificity": "The narrative lacks specific sensory details or recurring memory anchors that drive the plot or character decisions. The discovery of ancient scripts is a plot device but does not evoke sensory or emotional changes.",
    "Intergenerational Span & Long-term Causality": "The story does not emphasize intergenerational aspects or long-term consequences. The focus is on immediate survival and conflict resolution without exploring generational impacts or timelines.",
    "Institutional & Tech Ethical Complexity": "The depiction of alien invaders lacks depth, presenting them as a monolithic threat without exploring their motives or ethical complexity. Human institutions are not significantly addressed.",
    "Investigative Drive & Clue Architecture": "The narrative includes elements of investigation, such as exploring the cave and deciphering ancient secrets. However, the clues are not intricately layered, and the investigative process lacks tension and rising costs.",
    "Multi-layered Conflict": "The story presents internal, interpersonal, and extra-personal conflicts, particularly the protagonist's self-doubt and the external alien threat. However, these conflicts are not deeply interconnected or developed.",
    "Value Turns & Causal Cohesion": "The narrative includes value shifts, such as fear to courage, but these are predictable and not strongly linked through a causal chain. The progression feels linear and lacks surprising turns.",
    "Hierarchy of Beats & Midpoint/Climax Design": "The structure follows a clear three-act format with a climax, but the midpoint lacks a significant rule-changing reversal. The climax is effective but predictable.",
    "Emotional Punch & Aftershock": "Key scenes, such as the protagonist's decision to fight, have emotional impact but lack lasting aftershocks. The emotional journey is resolved quickly without lingering effects.",
    "Dual Resonance of Ending: Personal & Public": "The ending addresses both personal and public aspects, with the protagonist's growth and the societal victory. However, it lacks moral ambiguity and feels too neatly resolved."
  },
  "metrics": [
    {
      "name": "Character Depth & Moral Dilemma Arc",
      "score": 5,
      "justification": "The protagonist's internal struggle is evident, particularly in his fear and eventual acceptance of magic. However, the moral dilemma is not deeply explored, as the choice to fight is straightforward and lacks complexity. The transformation is more situational than internal."
    },
    {
      "name": "Memory Anchors & Sensory Specificity",
      "score": 4,
      "justification": "The narrative lacks specific sensory details or recurring memory anchors that drive the plot or character decisions. The discovery of ancient scripts is a plot device but does not evoke sensory or emotional changes."
    },
    {
      "name": "Intergenerational Span & Long-term Causality",
      "score": 3,
      "justification": "The story does not emphasize intergenerational aspects or long-term consequences. The focus is on immediate survival and conflict resolution without exploring generational impacts or timelines."
    },
    {
      "name": "Institutional & Tech Ethical Complexity",
      "score": 3,
      "justification": "The depiction of alien invaders lacks depth, presenting them as a monolithic threat without exploring their motives or ethical complexity. Human institutions are not significantly addressed."
    },
    {
      "name": "Investigative Drive & Clue Architecture",
      "score": 5,
      "justification": "The narrative includes elements of investigation, such as exploring the cave and deciphering ancient secrets. However, the clues are not intricately layered, and the investigative process lacks tension and rising costs."
    },
    {
      "name": "Multi-layered Conflict",
      "score": 6,
      "justification": "The story presents internal, interpersonal, and extra-personal conflicts, particularly the protagonist's self-doubt and the external alien threat. However, these conflicts are not deeply interconnected or developed."
    },
    {
      "name": "Value Turns & Causal Cohesion",
      "score": 5,
      "justification": "The narrative includes value shifts, such as fear to courage, but these are predictable and not strongly linked through a causal chain. The progression feels linear and lacks surprising turns."
    },
    {
      "name": "Hierarchy of Beats & Midpoint/Climax Design",
      "score": 6,
      "justification": "The structure follows a clear three-act format with a climax, but the midpoint lacks a significant rule-changing reversal. The climax is effective but predictable."
    },
    {
      "name": "Emotional Punch & Aftershock",
      "score": 5,
      "justification": "Key scenes, such as the protagonist's decision to fight, have emotional impact but lack lasting aftershocks. The emotional journey is resolved quickly without lingering effects."
    },
    {
      "name": "Dual Resonance of Ending: Personal & Public",
      "score": 6,
      "justification": "The ending addresses both personal and public aspects, with the protagonist's growth and the societal victory. However, it lacks moral ambiguity and feels too neatly resolved."
    }
  ],
  "overall_summary": "The narrative presents a post-apocalyptic scenario where human survivors rediscover ancient magical powers to combat alien invaders. The story follows a classic three-act structure, focusing on the protagonist's internal struggle and the collective effort to reclaim Earth. While the plot is engaging, it lacks depth in character development and complexity in institutional dynamics, relying heavily on familiar tropes.",
  "total_score": 48,
  "ai_response": "===EVALUATION_START===\nOVERALL_SUMMARY: The narrative presents a post-apocalyptic scenario where human survivors rediscover ancient magical powers to combat alien invaders. The story follows a classic three-act structure, focusing on the protagonist's internal struggle and the collective effort to reclaim Earth. While the plot is engaging, it lacks depth in character development and complexity in institutional dynamics, relying heavily on familiar tropes.\n\nCRITERION_SCORES:\nCRITERION_1|Character Depth & Moral Dilemma Arc|5|The protagonist's internal struggle is evident, particularly in his fear and eventual acceptance of magic. However, the moral dilemma is not deeply explored, as the choice to fight is straightforward and lacks complexity. The transformation is more situational than internal.\nCRITERION_2|Memory Anchors & Sensory Specificity|4|The narrative lacks specific sensory details or recurring memory anchors that drive the plot or character decisions. The discovery of ancient scripts is a plot device but does not evoke sensory or emotional changes.\nCRITERION_3|Intergenerational Span & Long-term Causality|3|The story does not emphasize intergenerational aspects or long-term consequences. The focus is on immediate survival and conflict resolution without exploring generational impacts or timelines.\nCRITERION_4|Institutional & Tech Ethical Complexity|3|The depiction of alien invaders lacks depth, presenting them as a monolithic threat without exploring their motives or ethical complexity. Human institutions are not significantly addressed.\nCRITERION_5|Investigative Drive & Clue Architecture|5|The narrative includes elements of investigation, such as exploring the cave and deciphering ancient secrets. However, the clues are not intricately layered, and the investigative process lacks tension and rising costs.\nCRITERION_6|Multi-layered Conflict|6|The story presents internal, interpersonal, and extra-personal conflicts, particularly the protagonist's self-doubt and the external alien threat. However, these conflicts are not deeply interconnected or developed.\nCRITERION_7|Value Turns & Causal Cohesion|5|The narrative includes value shifts, such as fear to courage, but these are predictable and not strongly linked through a causal chain. The progression feels linear and lacks surprising turns.\nCRITERION_8|Hierarchy of Beats & Midpoint/Climax Design|6|The structure follows a clear three-act format with a climax, but the midpoint lacks a significant rule-changing reversal. The climax is effective but predictable.\nCRITERION_9|Emotional Punch & Aftershock|5|Key scenes, such as the protagonist's decision to fight, have emotional impact but lack lasting aftershocks. The emotional journey is resolved quickly without lingering effects.\nCRITERION_10|Dual Resonance of Ending: Personal & Public|6|The ending addresses both personal and public aspects, with the protagonist's growth and the societal victory. However, it lacks moral ambiguity and feels too neatly resolved.\n===EVALUATION_END===",
  "created_at": "2025-09-01T01:54:12.420082+00:00"
}