{
  "user_name": "2-base2",
  "user_group": "writing_b1",
  "user_group_display": "写作 B-1",
  "submitted_text": "第一部分：故事概括\r\n\r\n在一个永生药物引发社会动荡的未来世界，一位被排除在外的“迷失的一代”成员在85岁时发现药物的致命副作用，揭露政府决策的错误，并在重新审视生命的意义中找到了内心的平衡。\r\n\r\n第二部分：第一幕\r\n\r\n故事开始于主角28岁时，科学界宣布发现了一种能够阻止衰老的药物，但政府只将其提供给26岁以下的公民，主角和他的同龄人被排除在外，被称为“迷失的一代”。随着时间的推移，主角目睹了年轻一代的永生生活，而他自己则逐渐老去，心中充满了不甘与失落。当他85岁时，世界突然爆发了关于永生药物副作用的新闻，打破了他对永生的幻想，促使他开始质疑生命的真正价值。\r\n\r\n第三部分：第二幕\r\n\r\n在得知药物的副作用后，主角开始调查这些副作用的真相，并与其他“迷失的一代”成员联手，试图揭露真相并警告那些已经服用药物的人。他们面临着来自政府和药物公司强大的阻力，同时也要处理自己内心的矛盾：是继续追求永生，还是接受自然的生命进程。随着调查的深入，主角发现副作用不仅影响身体，还对人类的情感和社会结构造成了深远的影响，这让他意识到生命的有限性和珍贵性。\r\n\r\n第四部分：第三幕\r\n\r\n在最终的对决中，主角和他的盟友成功揭露了药物的真相，迫使政府承认错误并停止药物的分发。主角在这一过程中重新找到了生命的意义，接受了自己的衰老，并与年轻一代建立了新的联系。故事以主角在新平衡中的生活结束，他不再追求永生，而是珍惜每一个有限的时刻，体现了对生命本质的深刻理解。",
  "scores": {
    "Character Depth & Moral Dilemma Arc": 8,
    "Memory Anchors & Sensory Specificity": 6,
    "Intergenerational Span & Long-term Causality": 9,
    "Institutional & Tech Ethical Complexity": 7,
    "Investigative Drive & Clue Architecture": 7,
    "Multi-layered Conflict": 8,
    "Value Turns & Causal Cohesion": 8,
    "Hierarchy of Beats & Midpoint/Climax Design": 7,
    "Emotional Punch & Aftershock": 8,
    "Dual Resonance of Ending: Personal & Public": 9
  },
  "justifications": {
    "Character Depth & Moral Dilemma Arc": "The protagonist's journey from resentment to acceptance of mortality is well-developed. The moral dilemma of whether to expose the drug's side effects or continue pursuing immortality is driven by internal motivations, leading to an irreversible transformation in the protagonist's values.",
    "Memory Anchors & Sensory Specificity": "While the narrative does not heavily rely on sensory details or recurring objects, the protagonist's memories of aging and exclusion serve as effective emotional anchors that influence his decisions.",
    "Intergenerational Span & Long-term Causality": "The story spans several decades, clearly contrasting the protagonist's aging with the eternal youth of others. The long-term consequences of the drug's exclusion are well-explored, impacting the protagonist's relationships and worldview.",
    "Institutional & Tech Ethical Complexity": "The government and pharmaceutical company's roles are depicted with some complexity, showing their motivations and the societal impact of their decisions. However, more depth in their portrayal could enhance the narrative.",
    "Investigative Drive & Clue Architecture": "The protagonist's investigation into the drug's side effects is a central plotline, with logical progression and rising stakes. The narrative maintains suspense as the protagonist uncovers the truth.",
    "Multi-layered Conflict": "The story effectively presents conflicts on internal, interpersonal, and societal levels. The protagonist's internal struggle is mirrored by external pressures from the government and societal expectations, creating a rich tapestry of conflict.",
    "Value Turns & Causal Cohesion": "Each act of the story brings significant value shifts, such as the protagonist's transition from envy to acceptance. These shifts are causally linked, providing a coherent narrative progression.",
    "Hierarchy of Beats & Midpoint/Climax Design": "The narrative structure is clear, with a well-defined midpoint where the protagonist's understanding of immortality changes. The climax delivers a decisive turn, though the escalation could be more pronounced.",
    "Emotional Punch & Aftershock": "Key scenes, such as the revelation of the drug's side effects, deliver strong emotional impact and continue to resonate throughout the story, influencing the protagonist's actions and relationships.",
    "Dual Resonance of Ending: Personal & Public": "The ending successfully addresses both personal and societal issues, with the protagonist finding personal closure and the government acknowledging its mistakes. The resolution maintains moral ambiguity, avoiding simplistic conclusions."
  },
  "metrics": [
    {
      "name": "Character Depth & Moral Dilemma Arc",
      "score": 8,
      "justification": "The protagonist's journey from resentment to acceptance of mortality is well-developed. The moral dilemma of whether to expose the drug's side effects or continue pursuing immortality is driven by internal motivations, leading to an irreversible transformation in the protagonist's values."
    },
    {
      "name": "Memory Anchors & Sensory Specificity",
      "score": 6,
      "justification": "While the narrative does not heavily rely on sensory details or recurring objects, the protagonist's memories of aging and exclusion serve as effective emotional anchors that influence his decisions."
    },
    {
      "name": "Intergenerational Span & Long-term Causality",
      "score": 9,
      "justification": "The story spans several decades, clearly contrasting the protagonist's aging with the eternal youth of others. The long-term consequences of the drug's exclusion are well-explored, impacting the protagonist's relationships and worldview."
    },
    {
      "name": "Institutional & Tech Ethical Complexity",
      "score": 7,
      "justification": "The government and pharmaceutical company's roles are depicted with some complexity, showing their motivations and the societal impact of their decisions. However, more depth in their portrayal could enhance the narrative."
    },
    {
      "name": "Investigative Drive & Clue Architecture",
      "score": 7,
      "justification": "The protagonist's investigation into the drug's side effects is a central plotline, with logical progression and rising stakes. The narrative maintains suspense as the protagonist uncovers the truth."
    },
    {
      "name": "Multi-layered Conflict",
      "score": 8,
      "justification": "The story effectively presents conflicts on internal, interpersonal, and societal levels. The protagonist's internal struggle is mirrored by external pressures from the government and societal expectations, creating a rich tapestry of conflict."
    },
    {
      "name": "Value Turns & Causal Cohesion",
      "score": 8,
      "justification": "Each act of the story brings significant value shifts, such as the protagonist's transition from envy to acceptance. These shifts are causally linked, providing a coherent narrative progression."
    },
    {
      "name": "Hierarchy of Beats & Midpoint/Climax Design",
      "score": 7,
      "justification": "The narrative structure is clear, with a well-defined midpoint where the protagonist's understanding of immortality changes. The climax delivers a decisive turn, though the escalation could be more pronounced."
    },
    {
      "name": "Emotional Punch & Aftershock",
      "score": 8,
      "justification": "Key scenes, such as the revelation of the drug's side effects, deliver strong emotional impact and continue to resonate throughout the story, influencing the protagonist's actions and relationships."
    },
    {
      "name": "Dual Resonance of Ending: Personal & Public",
      "score": 9,
      "justification": "The ending successfully addresses both personal and societal issues, with the protagonist finding personal closure and the government acknowledging its mistakes. The resolution maintains moral ambiguity, avoiding simplistic conclusions."
    }
  ],
  "overall_summary": "The narrative presents a compelling exploration of the consequences of a society obsessed with immortality, focusing on a protagonist from the \"lost generation\" who is excluded from the benefits of an anti-aging drug. The story effectively uses a futuristic setting to delve into themes of mortality, societal inequality, and personal growth, culminating in a satisfying resolution that balances personal and societal change.",
  "total_score": 77,
  "ai_response": "===EVALUATION_START===\nOVERALL_SUMMARY: The narrative presents a compelling exploration of the consequences of a society obsessed with immortality, focusing on a protagonist from the \"lost generation\" who is excluded from the benefits of an anti-aging drug. The story effectively uses a futuristic setting to delve into themes of mortality, societal inequality, and personal growth, culminating in a satisfying resolution that balances personal and societal change.\n\nCRITERION_SCORES:\nCRITERION_1|Character Depth & Moral Dilemma Arc|8|The protagonist's journey from resentment to acceptance of mortality is well-developed. The moral dilemma of whether to expose the drug's side effects or continue pursuing immortality is driven by internal motivations, leading to an irreversible transformation in the protagonist's values.\nCRITERION_2|Memory Anchors & Sensory Specificity|6|While the narrative does not heavily rely on sensory details or recurring objects, the protagonist's memories of aging and exclusion serve as effective emotional anchors that influence his decisions.\nCRITERION_3|Intergenerational Span & Long-term Causality|9|The story spans several decades, clearly contrasting the protagonist's aging with the eternal youth of others. The long-term consequences of the drug's exclusion are well-explored, impacting the protagonist's relationships and worldview.\nCRITERION_4|Institutional & Tech Ethical Complexity|7|The government and pharmaceutical company's roles are depicted with some complexity, showing their motivations and the societal impact of their decisions. However, more depth in their portrayal could enhance the narrative.\nCRITERION_5|Investigative Drive & Clue Architecture|7|The protagonist's investigation into the drug's side effects is a central plotline, with logical progression and rising stakes. The narrative maintains suspense as the protagonist uncovers the truth.\nCRITERION_6|Multi-layered Conflict|8|The story effectively presents conflicts on internal, interpersonal, and societal levels. The protagonist's internal struggle is mirrored by external pressures from the government and societal expectations, creating a rich tapestry of conflict.\nCRITERION_7|Value Turns & Causal Cohesion|8|Each act of the story brings significant value shifts, such as the protagonist's transition from envy to acceptance. These shifts are causally linked, providing a coherent narrative progression.\nCRITERION_8|Hierarchy of Beats & Midpoint/Climax Design|7|The narrative structure is clear, with a well-defined midpoint where the protagonist's understanding of immortality changes. The climax delivers a decisive turn, though the escalation could be more pronounced.\nCRITERION_9|Emotional Punch & Aftershock|8|Key scenes, such as the revelation of the drug's side effects, deliver strong emotional impact and continue to resonate throughout the story, influencing the protagonist's actions and relationships.\nCRITERION_10|Dual Resonance of Ending: Personal & Public|9|The ending successfully addresses both personal and societal issues, with the protagonist finding personal closure and the government acknowledging its mistakes. The resolution maintains moral ambiguity, avoiding simplistic conclusions.\n===EVALUATION_END===",
  "created_at": "2025-08-28T13:03:22.730719+00:00"
}