{
  "user_name": "刘彦淞",
  "user_group": "writing_b2",
  "user_group_display": "写作 B-2",
  "submitted_text": "工具结果执行结果\r\n第一部分：故事概括\r\n\r\n在一个因永生药物引发社会不平等的未来，85岁的主角揭露药物的致命副作用，挑战不公制度，唤醒被遗忘的“迷失的一代”，最终推动社会变革，呼唤人们重新审视生命的真正价值。\r\n第二部分：第一幕\r\n\r\n故事开始于主角28岁时，科学界宣布发现一种能阻止衰老的药物，但政府只将其提供给26岁以下的公民，主角和“迷失的一代”被排除在外。面对教育、医疗、住房等方面的巨大压力，政府推出永生药物作为缓解社会矛盾的解决方案，然而，主角心怀不满却无能为力，只能看着年轻一代享受永生的特权。随着时间推移，主角逐渐接受了自己的命运，直到85岁时，药物的副作用开始显现，年轻一代的健康状况急剧恶化，社会陷入恐慌。\r\n第三部分：第二幕\r\n\r\n主角意识到这是揭露真相的机会，他开始调查药物的真实影响，并与其他“迷失的一代”成员联手，收集证据。随着调查深入，主角发现政府和制药公司早已知晓副作用，却选择隐瞒真相以维持权力和利益。药物的副作用不仅导致身体机能的崩溃，还引发了严重的心理问题，年轻一代的精神状态逐渐恶化。主角面临内心的挣扎，是否要冒险揭露真相，最终在一次公共演讲中，他勇敢地揭示了药物的危害，引发社会的广泛关注和抗议。\r\n第四部分：第三幕\r\n\r\n在社会动荡中，主角和他的盟友们面临来自政府和制药公司的强烈反击，但他们坚定不移，继续推动真相的传播。最终，随着越来越多的证据曝光，政府被迫承认错误，停止药物的分发，并开始研究解决方案。主角在这一过程中找到了内心的平衡，虽然无法获得永生，但他通过自己的努力改变了社会的不公，迎来了一个更加公平的未来。结尾处，人们开始反思生命的意义，意识到真正的永生在于对生命价值的理解和珍惜。",
  "scores": {
    "Character Depth & Moral Dilemma Arc": 8,
    "Memory Anchors & Sensory Specificity": 5,
    "Intergenerational Span & Long-term Causality": 9,
    "Institutional & Tech Ethical Complexity": 8,
    "Investigative Drive & Clue Architecture": 7,
    "Multi-layered Conflict": 8,
    "Value Turns & Causal Cohesion": 7,
    "Hierarchy of Beats & Midpoint/Climax Design": 8,
    "Emotional Punch & Aftershock": 7,
    "Dual Resonance of Ending: Personal & Public": 9
  },
  "justifications": {
    "Character Depth & Moral Dilemma Arc": "The protagonist faces a profound moral dilemma, choosing between personal safety and societal truth. His transformation from acceptance of fate to active resistance is well-supported by his internal motivations and the irreversible change in his values.",
    "Memory Anchors & Sensory Specificity": "While the narrative mentions the protagonist's age and societal changes, it lacks specific sensory details or recurring objects that trigger memories or decisions, limiting emotional depth.",
    "Intergenerational Span & Long-term Causality": "The story effectively spans generations, contrasting the protagonist's life at 28 and 85, with clear consequences of early decisions impacting later societal and personal outcomes.",
    "Institutional & Tech Ethical Complexity": "The narrative provides a nuanced view of government and corporate interests, revealing their motives and ethical breaches. The institutions' actions directly influence the protagonist's choices and societal dynamics.",
    "Investigative Drive & Clue Architecture": "The protagonist's investigation into the drug's effects drives the plot, with evidence gathering creating tension and leading to societal upheaval. However, the layering of clues could be more intricate.",
    "Multi-layered Conflict": "Conflicts are present on multiple levels: personal (protagonist's moral struggle), interpersonal (with peers), and institutional (against government and corporations), effectively interwoven to heighten tension.",
    "Value Turns & Causal Cohesion": "The narrative includes clear value shifts, particularly in the protagonist's public revelation of the drug's dangers. These shifts are causally linked, though some transitions could be more deeply explored.",
    "Hierarchy of Beats & Midpoint/Climax Design": "The story's structure is well-defined, with a midpoint reversal when the protagonist decides to reveal the truth, leading to an impactful climax that changes societal norms.",
    "Emotional Punch & Aftershock": "Key scenes, such as the public speech, deliver emotional impact and provoke societal reactions. However, the emotional resonance could be further sustained through more detailed aftermath exploration.",
    "Dual Resonance of Ending: Personal & Public": "The ending achieves dual resonance, addressing personal closure for the protagonist and societal reflection on life's value, maintaining moral ambiguity and avoiding simplistic resolutions."
  },
  "metrics": [
    {
      "name": "Character Depth & Moral Dilemma Arc",
      "score": 8,
      "justification": "The protagonist faces a profound moral dilemma, choosing between personal safety and societal truth. His transformation from acceptance of fate to active resistance is well-supported by his internal motivations and the irreversible change in his values."
    },
    {
      "name": "Memory Anchors & Sensory Specificity",
      "score": 5,
      "justification": "While the narrative mentions the protagonist's age and societal changes, it lacks specific sensory details or recurring objects that trigger memories or decisions, limiting emotional depth."
    },
    {
      "name": "Intergenerational Span & Long-term Causality",
      "score": 9,
      "justification": "The story effectively spans generations, contrasting the protagonist's life at 28 and 85, with clear consequences of early decisions impacting later societal and personal outcomes."
    },
    {
      "name": "Institutional & Tech Ethical Complexity",
      "score": 8,
      "justification": "The narrative provides a nuanced view of government and corporate interests, revealing their motives and ethical breaches. The institutions' actions directly influence the protagonist's choices and societal dynamics."
    },
    {
      "name": "Investigative Drive & Clue Architecture",
      "score": 7,
      "justification": "The protagonist's investigation into the drug's effects drives the plot, with evidence gathering creating tension and leading to societal upheaval. However, the layering of clues could be more intricate."
    },
    {
      "name": "Multi-layered Conflict",
      "score": 8,
      "justification": "Conflicts are present on multiple levels: personal (protagonist's moral struggle), interpersonal (with peers), and institutional (against government and corporations), effectively interwoven to heighten tension."
    },
    {
      "name": "Value Turns & Causal Cohesion",
      "score": 7,
      "justification": "The narrative includes clear value shifts, particularly in the protagonist's public revelation of the drug's dangers. These shifts are causally linked, though some transitions could be more deeply explored."
    },
    {
      "name": "Hierarchy of Beats & Midpoint/Climax Design",
      "score": 8,
      "justification": "The story's structure is well-defined, with a midpoint reversal when the protagonist decides to reveal the truth, leading to an impactful climax that changes societal norms."
    },
    {
      "name": "Emotional Punch & Aftershock",
      "score": 7,
      "justification": "Key scenes, such as the public speech, deliver emotional impact and provoke societal reactions. However, the emotional resonance could be further sustained through more detailed aftermath exploration."
    },
    {
      "name": "Dual Resonance of Ending: Personal & Public",
      "score": 9,
      "justification": "The ending achieves dual resonance, addressing personal closure for the protagonist and societal reflection on life's value, maintaining moral ambiguity and avoiding simplistic resolutions."
    }
  ],
  "overall_summary": "The narrative presents a compelling story set in a dystopian future where a drug promising eternal youth creates societal inequality. The protagonist, initially excluded from its benefits, ultimately uncovers its harmful effects, leading to societal change. The text explores themes of moral courage, societal justice, and the true value of life, with a focus on intergenerational conflict and ethical dilemmas.",
  "total_score": 76,
  "ai_response": "===EVALUATION_START===\nOVERALL_SUMMARY: The narrative presents a compelling story set in a dystopian future where a drug promising eternal youth creates societal inequality. The protagonist, initially excluded from its benefits, ultimately uncovers its harmful effects, leading to societal change. The text explores themes of moral courage, societal justice, and the true value of life, with a focus on intergenerational conflict and ethical dilemmas.\n\nCRITERION_SCORES:\nCRITERION_1|Character Depth & Moral Dilemma Arc|8|The protagonist faces a profound moral dilemma, choosing between personal safety and societal truth. His transformation from acceptance of fate to active resistance is well-supported by his internal motivations and the irreversible change in his values.\nCRITERION_2|Memory Anchors & Sensory Specificity|5|While the narrative mentions the protagonist's age and societal changes, it lacks specific sensory details or recurring objects that trigger memories or decisions, limiting emotional depth.\nCRITERION_3|Intergenerational Span & Long-term Causality|9|The story effectively spans generations, contrasting the protagonist's life at 28 and 85, with clear consequences of early decisions impacting later societal and personal outcomes.\nCRITERION_4|Institutional & Tech Ethical Complexity|8|The narrative provides a nuanced view of government and corporate interests, revealing their motives and ethical breaches. The institutions' actions directly influence the protagonist's choices and societal dynamics.\nCRITERION_5|Investigative Drive & Clue Architecture|7|The protagonist's investigation into the drug's effects drives the plot, with evidence gathering creating tension and leading to societal upheaval. However, the layering of clues could be more intricate.\nCRITERION_6|Multi-layered Conflict|8|Conflicts are present on multiple levels: personal (protagonist's moral struggle), interpersonal (with peers), and institutional (against government and corporations), effectively interwoven to heighten tension.\nCRITERION_7|Value Turns & Causal Cohesion|7|The narrative includes clear value shifts, particularly in the protagonist's public revelation of the drug's dangers. These shifts are causally linked, though some transitions could be more deeply explored.\nCRITERION_8|Hierarchy of Beats & Midpoint/Climax Design|8|The story's structure is well-defined, with a midpoint reversal when the protagonist decides to reveal the truth, leading to an impactful climax that changes societal norms.\nCRITERION_9|Emotional Punch & Aftershock|7|Key scenes, such as the public speech, deliver emotional impact and provoke societal reactions. However, the emotional resonance could be further sustained through more detailed aftermath exploration.\nCRITERION_10|Dual Resonance of Ending: Personal & Public|9|The ending achieves dual resonance, addressing personal closure for the protagonist and societal reflection on life's value, maintaining moral ambiguity and avoiding simplistic resolutions.\n===EVALUATION_END===",
  "created_at": "2025-08-30T03:09:22.165789+00:00"
}