{
  "user_name": "zbx",
  "user_group": "writing_a1",
  "user_group_display": "写作 A-1",
  "submitted_text": "第一部分：故事概括\r\n在人类文明被外星入侵者摧毁的绝望时刻，一位专注于古代魔法研究的大学教授意外发现魔法力量正在复苏，他必须带领幸存者利用这股力量对抗强大的外星敌人，重建希望。\r\n\r\n第二部分：第一幕\r\n在地球上，人口过多导致魔法力量几乎消失，外星入侵者的到来使人类文明遭受毁灭性打击，幸存者们在绝望中挣扎。 主角，一位专注于古代魔法研究的大学教授，目睹了外星人强大的科技和心理压迫，感到无能为力。 然而，当他意外发现自己家族传承的古老魔法书籍开始发光时，他意识到魔法力量正在复苏，并开始探索这股力量的潜力。\r\n\r\n第三部分：第二幕\r\n教授和一群幸存者开始研究如何利用复苏的魔法力量对抗外星人，他们在废墟中寻找盟友，并逐渐掌握了初步的魔法技能。 随着他们的力量增强，他们开始对外星人展开小规模的反击，取得了一些胜利。 然而，外星人很快加强了攻势，教授面临着巨大的内心挣扎，怀疑自己是否有能力带领人类走向胜利。 在一次关键的战斗中，教授失去了重要的盟友，陷入至暗时刻，但他从中获得了新的洞察，决定利用魔法的真正潜力进行最后的反击。\r\n\r\n第四部分：第三幕\r\n教授重新聚集幸存者，制定了一个大胆的计划，利用魔法力量摧毁外星人的核心科技。 在最终对决中，教授和他的团队运用他们所学的魔法技能，与外星人展开激烈的战斗。 教授在关键时刻做出了牺牲，释放出强大的魔法力量，最终摧毁了外星人的主舰，解放了地球。 随着外星人撤退，幸存者们开始重建家园，魔法力量的复苏为人类带来了新的希望和未来。",
  "scores": {
    "Character Depth & Moral Dilemma Arc": 6,
    "Memory Anchors & Sensory Specificity": 5,
    "Intergenerational Span & Long-term Causality": 4,
    "Institutional & Tech Ethical Complexity": 5,
    "Investigative Drive & Clue Architecture": 6,
    "Multi-layered Conflict": 7,
    "Value Turns & Causal Cohesion": 6,
    "Hierarchy of Beats & Midpoint/Climax Design": 7,
    "Emotional Punch & Aftershock": 6,
    "Dual Resonance of Ending: Personal & Public": 7
  },
  "justifications": {
    "Character Depth & Moral Dilemma Arc": "The protagonist faces internal struggles, particularly regarding his ability to lead and the loss of allies. However, the moral dilemma is somewhat underdeveloped, focusing more on external pressures than internal motivations.",
    "Memory Anchors & Sensory Specificity": "The narrative mentions the family heritage of magical books, but lacks recurring sensory details or specific memory anchors that drive the plot or character decisions.",
    "Intergenerational Span & Long-term Causality": "There is a mention of family heritage, but the narrative does not delve deeply into intergenerational timelines or long-term consequences of past actions.",
    "Institutional & Tech Ethical Complexity": "The alien invaders are depicted as technologically advanced, but their motives and ethical complexity are not explored in depth, presenting them primarily as antagonists without nuanced interests.",
    "Investigative Drive & Clue Architecture": "The story involves the investigation of magical powers, with the protagonist and survivors gradually mastering skills. However, the clue architecture lacks complexity and suspenseful layering.",
    "Multi-layered Conflict": "The narrative includes internal struggles, interpersonal relationships among survivors, and the external alien threat, effectively interconnecting these layers to push the protagonist.",
    "Value Turns & Causal Cohesion": "There are recognizable shifts, such as despair to hope, but the causal chain of motivation-action-effect is not consistently strong, with some reliance on external events.",
    "Hierarchy of Beats & Midpoint/Climax Design": "The structure follows a clear progression with escalating stakes, and the climax involves a significant sacrifice and irreversible change, though the midpoint could be more transformative.",
    "Emotional Punch & Aftershock": "Key scenes, such as the loss of allies, provide emotional impact, but the aftershocks are not deeply explored in subsequent actions or reflections.",
    "Dual Resonance of Ending: Personal & Public": "The ending addresses personal sacrifice and societal rebuilding, offering both psychological closure and public hope, though it leans towards a positive resolution without much ambiguity."
  },
  "metrics": [
    {
      "name": "Character Depth & Moral Dilemma Arc",
      "score": 6,
      "justification": "The protagonist faces internal struggles, particularly regarding his ability to lead and the loss of allies. However, the moral dilemma is somewhat underdeveloped, focusing more on external pressures than internal motivations."
    },
    {
      "name": "Memory Anchors & Sensory Specificity",
      "score": 5,
      "justification": "The narrative mentions the family heritage of magical books, but lacks recurring sensory details or specific memory anchors that drive the plot or character decisions."
    },
    {
      "name": "Intergenerational Span & Long-term Causality",
      "score": 4,
      "justification": "There is a mention of family heritage, but the narrative does not delve deeply into intergenerational timelines or long-term consequences of past actions."
    },
    {
      "name": "Institutional & Tech Ethical Complexity",
      "score": 5,
      "justification": "The alien invaders are depicted as technologically advanced, but their motives and ethical complexity are not explored in depth, presenting them primarily as antagonists without nuanced interests."
    },
    {
      "name": "Investigative Drive & Clue Architecture",
      "score": 6,
      "justification": "The story involves the investigation of magical powers, with the protagonist and survivors gradually mastering skills. However, the clue architecture lacks complexity and suspenseful layering."
    },
    {
      "name": "Multi-layered Conflict",
      "score": 7,
      "justification": "The narrative includes internal struggles, interpersonal relationships among survivors, and the external alien threat, effectively interconnecting these layers to push the protagonist."
    },
    {
      "name": "Value Turns & Causal Cohesion",
      "score": 6,
      "justification": "There are recognizable shifts, such as despair to hope, but the causal chain of motivation-action-effect is not consistently strong, with some reliance on external events."
    },
    {
      "name": "Hierarchy of Beats & Midpoint/Climax Design",
      "score": 7,
      "justification": "The structure follows a clear progression with escalating stakes, and the climax involves a significant sacrifice and irreversible change, though the midpoint could be more transformative."
    },
    {
      "name": "Emotional Punch & Aftershock",
      "score": 6,
      "justification": "Key scenes, such as the loss of allies, provide emotional impact, but the aftershocks are not deeply explored in subsequent actions or reflections."
    },
    {
      "name": "Dual Resonance of Ending: Personal & Public",
      "score": 7,
      "justification": "The ending addresses personal sacrifice and societal rebuilding, offering both psychological closure and public hope, though it leans towards a positive resolution without much ambiguity."
    }
  ],
  "overall_summary": "The narrative presents a classic tale of resistance against alien invaders using the revival of ancient magic. It follows a university professor who discovers the resurgence of magical powers and leads survivors in a fight against technologically advanced aliens. The story is structured in three acts, detailing the discovery, initial struggles, and ultimate victory, with themes of sacrifice and hope.",
  "total_score": 59,
  "ai_response": "===EVALUATION_START===\nOVERALL_SUMMARY: The narrative presents a classic tale of resistance against alien invaders using the revival of ancient magic. It follows a university professor who discovers the resurgence of magical powers and leads survivors in a fight against technologically advanced aliens. The story is structured in three acts, detailing the discovery, initial struggles, and ultimate victory, with themes of sacrifice and hope.\n\nCRITERION_SCORES:\nCRITERION_1|Character Depth & Moral Dilemma Arc|6|The protagonist faces internal struggles, particularly regarding his ability to lead and the loss of allies. However, the moral dilemma is somewhat underdeveloped, focusing more on external pressures than internal motivations.\nCRITERION_2|Memory Anchors & Sensory Specificity|5|The narrative mentions the family heritage of magical books, but lacks recurring sensory details or specific memory anchors that drive the plot or character decisions.\nCRITERION_3|Intergenerational Span & Long-term Causality|4|There is a mention of family heritage, but the narrative does not delve deeply into intergenerational timelines or long-term consequences of past actions.\nCRITERION_4|Institutional & Tech Ethical Complexity|5|The alien invaders are depicted as technologically advanced, but their motives and ethical complexity are not explored in depth, presenting them primarily as antagonists without nuanced interests.\nCRITERION_5|Investigative Drive & Clue Architecture|6|The story involves the investigation of magical powers, with the protagonist and survivors gradually mastering skills. However, the clue architecture lacks complexity and suspenseful layering.\nCRITERION_6|Multi-layered Conflict|7|The narrative includes internal struggles, interpersonal relationships among survivors, and the external alien threat, effectively interconnecting these layers to push the protagonist.\nCRITERION_7|Value Turns & Causal Cohesion|6|There are recognizable shifts, such as despair to hope, but the causal chain of motivation-action-effect is not consistently strong, with some reliance on external events.\nCRITERION_8|Hierarchy of Beats & Midpoint/Climax Design|7|The structure follows a clear progression with escalating stakes, and the climax involves a significant sacrifice and irreversible change, though the midpoint could be more transformative.\nCRITERION_9|Emotional Punch & Aftershock|6|Key scenes, such as the loss of allies, provide emotional impact, but the aftershocks are not deeply explored in subsequent actions or reflections.\nCRITERION_10|Dual Resonance of Ending: Personal & Public|7|The ending addresses personal sacrifice and societal rebuilding, offering both psychological closure and public hope, though it leans towards a positive resolution without much ambiguity.\n===EVALUATION_END===",
  "created_at": "2025-09-01T01:53:56.016695+00:00"
}