{
  "user_name": "test828",
  "user_group": "writing_b2",
  "user_group_display": "写作 B-2",
  "submitted_text": "第一部分：故事概括\r\n在一个永生药物改变人类命运的世界中，一位被排除在外的“迷失的一代”成员在85岁时发现药物的致命副作用，他在揭露真相的过程中，面临着保护自己享受永生药物的后代的艰难选择，最终揭示出人性复杂却充满希望的本质。\r\n\r\n第二部分：第一幕\r\n故事开始于主角28岁时，科学家宣布发现一种可以阻止衰老的药物，政府决定只提供给26岁以下的公民，主角和他的同龄人被称为“迷失的一代”，被排除在外。随着时间的推移，主角目睹自己的孩子享受永生的特权，而他自己则逐渐老去，心中充满不甘与失落。当他85岁时，主角偶然发现永生药物的副作用正在悄然显现，威胁着所有使用者的生命。\r\n\r\n第三部分：第二幕\r\n主角开始调查药物的真相，发现政府早已知晓副作用却选择隐瞒，为了保护自己的利益。随着调查的深入，他结识了一群同样被排除在外的“迷失的一代”成员，他们决定联手揭露真相。在这个过程中，主角面临来自政府的威胁和内心的挣扎，他必须在揭露真相和保护自己享受永生药物的后代之间做出艰难选择。随着时间的推移，药物的副作用愈发明显，社会开始动荡不安，而他的后代也因担心而与他产生冲突，但最终选择支持他的决定。\r\n\r\n第四部分：第三幕\r\n在最终对决中，主角和他的盟友们成功揭露了药物的真相，迫使政府公开承认错误并停止药物的分发。已经使用药物的人面临着逐渐失去永生效果的恐慌和健康问题的威胁，社会陷入混乱。尽管这一胜利来之不易，但主角意识到人类对永生的追求终究无法逃避自然规律。他选择回归平凡的生活，珍惜有限的时光，与家人和朋友共度余生。主角与后代在经历了风雨后更加珍惜彼此，故事以主角的内心平和结束，展现出在复杂的人性中仍然存在希望与爱的力量。",
  "scores": {
    "Character Depth & Moral Dilemma Arc": 6,
    "Memory Anchors & Sensory Specificity": 4,
    "Intergenerational Span & Long-term Causality": 6,
    "Institutional & Tech Ethical Complexity": 5,
    "Investigative Drive & Clue Architecture": 5,
    "Multi-layered Conflict": 6,
    "Value Turns & Causal Cohesion": 5,
    "Hierarchy of Beats & Midpoint/Climax Design": 5,
    "Emotional Punch & Aftershock": 6,
    "Dual Resonance of Ending: Personal & Public": 6
  },
  "justifications": {
    "Character Depth & Moral Dilemma Arc": "The protagonist faces a profound moral dilemma between revealing the truth about the drug and protecting his descendants who benefit from it. This choice leads to an irreversible transformation in his values, supported by temporal evidence as he ages from 28 to 85.",
    "Memory Anchors & Sensory Specificity": "While the narrative mentions the protagonist's observations over time, it lacks recurring sensory details or specific memory anchors that drive plot progression or character decisions.",
    "Intergenerational Span & Long-term Causality": "The story clearly spans generations, contrasting the protagonist's aging with his descendants' immortality. Long-term consequences of the drug are evident, affecting relationships and societal stability.",
    "Institutional & Tech Ethical Complexity": "The government is depicted with a mix of self-interest and fear, knowing the drug's side effects yet choosing to hide them. This complexity is present but could be further explored with more detailed institutional evidence.",
    "Investigative Drive & Clue Architecture": "The protagonist's investigation into the drug's truth drives the plot, with rising costs and risks. However, the layering of clues could be more intricate to enhance suspense.",
    "Multi-layered Conflict": "The narrative effectively presents internal, interpersonal, and extra-personal conflicts, with the protagonist's inner struggle, family disputes, and governmental pressure interwoven to push him to his limits.",
    "Value Turns & Causal Cohesion": "The story includes clear value shifts, such as trust to suspicion and societal chaos, linked through a causal chain. However, some transitions could be more forcefully explained to avoid feeling coincidental.",
    "Hierarchy of Beats & Midpoint/Climax Design": "The narrative structure includes a midpoint where the protagonist's goals shift significantly, leading to a climax with irreversible societal change. The escalation is present but could be more pronounced.",
    "Emotional Punch & Aftershock": "Key scenes, such as the revelation of the drug's truth, deliver strong emotional impact and have lasting effects on character relationships and societal dynamics.",
    "Dual Resonance of Ending: Personal & Public": "The ending resonates personally with the protagonist's reconciliation and publicly with societal chaos, maintaining moral ambiguity and avoiding simplistic resolutions."
  },
  "metrics": [
    {
      "name": "Character Depth & Moral Dilemma Arc",
      "score": 6,
      "justification": "The protagonist faces a profound moral dilemma between revealing the truth about the drug and protecting his descendants who benefit from it. This choice leads to an irreversible transformation in his values, supported by temporal evidence as he ages from 28 to 85."
    },
    {
      "name": "Memory Anchors & Sensory Specificity",
      "score": 4,
      "justification": "While the narrative mentions the protagonist's observations over time, it lacks recurring sensory details or specific memory anchors that drive plot progression or character decisions."
    },
    {
      "name": "Intergenerational Span & Long-term Causality",
      "score": 6,
      "justification": "The story clearly spans generations, contrasting the protagonist's aging with his descendants' immortality. Long-term consequences of the drug are evident, affecting relationships and societal stability."
    },
    {
      "name": "Institutional & Tech Ethical Complexity",
      "score": 5,
      "justification": "The government is depicted with a mix of self-interest and fear, knowing the drug's side effects yet choosing to hide them. This complexity is present but could be further explored with more detailed institutional evidence."
    },
    {
      "name": "Investigative Drive & Clue Architecture",
      "score": 5,
      "justification": "The protagonist's investigation into the drug's truth drives the plot, with rising costs and risks. However, the layering of clues could be more intricate to enhance suspense."
    },
    {
      "name": "Multi-layered Conflict",
      "score": 6,
      "justification": "The narrative effectively presents internal, interpersonal, and extra-personal conflicts, with the protagonist's inner struggle, family disputes, and governmental pressure interwoven to push him to his limits."
    },
    {
      "name": "Value Turns & Causal Cohesion",
      "score": 5,
      "justification": "The story includes clear value shifts, such as trust to suspicion and societal chaos, linked through a causal chain. However, some transitions could be more forcefully explained to avoid feeling coincidental."
    },
    {
      "name": "Hierarchy of Beats & Midpoint/Climax Design",
      "score": 5,
      "justification": "The narrative structure includes a midpoint where the protagonist's goals shift significantly, leading to a climax with irreversible societal change. The escalation is present but could be more pronounced."
    },
    {
      "name": "Emotional Punch & Aftershock",
      "score": 6,
      "justification": "Key scenes, such as the revelation of the drug's truth, deliver strong emotional impact and have lasting effects on character relationships and societal dynamics."
    },
    {
      "name": "Dual Resonance of Ending: Personal & Public",
      "score": 6,
      "justification": "The ending resonates personally with the protagonist's reconciliation and publicly with societal chaos, maintaining moral ambiguity and avoiding simplistic resolutions."
    }
  ],
  "overall_summary": "The narrative explores a world transformed by a drug granting immortality, focusing on a protagonist from the \"lost generation\" who uncovers the drug's fatal side effects. The story effectively intertwines personal and societal dilemmas, leading to a climax where truth is revealed and the protagonist reconciles with his family, highlighting themes of hope and human complexity.",
  "total_score": 54,
  "ai_response": "===EVALUATION_START===\nOVERALL_SUMMARY: The narrative explores a world transformed by a drug granting immortality, focusing on a protagonist from the \"lost generation\" who uncovers the drug's fatal side effects. The story effectively intertwines personal and societal dilemmas, leading to a climax where truth is revealed and the protagonist reconciles with his family, highlighting themes of hope and human complexity.\n\nCRITERION_SCORES:\nCRITERION_1|Character Depth & Moral Dilemma Arc|6|The protagonist faces a profound moral dilemma between revealing the truth about the drug and protecting his descendants who benefit from it. This choice leads to an irreversible transformation in his values, supported by temporal evidence as he ages from 28 to 85.\nCRITERION_2|Memory Anchors & Sensory Specificity|4|While the narrative mentions the protagonist's observations over time, it lacks recurring sensory details or specific memory anchors that drive plot progression or character decisions.\nCRITERION_3|Intergenerational Span & Long-term Causality|6|The story clearly spans generations, contrasting the protagonist's aging with his descendants' immortality. Long-term consequences of the drug are evident, affecting relationships and societal stability.\nCRITERION_4|Institutional & Tech Ethical Complexity|5|The government is depicted with a mix of self-interest and fear, knowing the drug's side effects yet choosing to hide them. This complexity is present but could be further explored with more detailed institutional evidence.\nCRITERION_5|Investigative Drive & Clue Architecture|5|The protagonist's investigation into the drug's truth drives the plot, with rising costs and risks. However, the layering of clues could be more intricate to enhance suspense.\nCRITERION_6|Multi-layered Conflict|6|The narrative effectively presents internal, interpersonal, and extra-personal conflicts, with the protagonist's inner struggle, family disputes, and governmental pressure interwoven to push him to his limits.\nCRITERION_7|Value Turns & Causal Cohesion|5|The story includes clear value shifts, such as trust to suspicion and societal chaos, linked through a causal chain. However, some transitions could be more forcefully explained to avoid feeling coincidental.\nCRITERION_8|Hierarchy of Beats & Midpoint/Climax Design|5|The narrative structure includes a midpoint where the protagonist's goals shift significantly, leading to a climax with irreversible societal change. The escalation is present but could be more pronounced.\nCRITERION_9|Emotional Punch & Aftershock|6|Key scenes, such as the revelation of the drug's truth, deliver strong emotional impact and have lasting effects on character relationships and societal dynamics.\nCRITERION_10|Dual Resonance of Ending: Personal & Public|6|The ending resonates personally with the protagonist's reconciliation and publicly with societal chaos, maintaining moral ambiguity and avoiding simplistic resolutions.\n===EVALUATION_END===",
  "created_at": "2025-08-28T12:35:13.053538+00:00"
}