{
  "user_name": "t-n",
  "user_group": "writing_a2",
  "user_group_display": "写作 A-2",
  "submitted_text": "第一部分：故事概括 在一个科学发现永生药物的世界中，28岁的陈嘉如被排除在外，成为“迷失的一代”。随着时间推移，她发现药物的副作用和背后的阴谋，最终在85岁时，她揭露真相并找到预防副作用的方法，重新定义生命的意义。\r\n\r\n第二部分：第一幕 在28岁时，陈嘉如得知政府将永生药物提供给26岁以下的公民，她感到震惊和失落。她努力争取机会，却被告知风险过高而被拒绝。随着时间的推移，她开始怀疑药物的真正效果，并发现科学家们隐藏了一个关于药物副作用的秘密。她的生活在这个秘密的阴影下逐渐失去平衡。\r\n\r\n第三部分：第二幕 陈嘉如开始深入调查药物的真相，结识了一群同样被排除在外的“迷失的一代”成员，他们共同发现药物的副作用正在悄然显现。她面临着内心的挣扎和社会的压力，逐渐揭开政府和科学家之间的阴谋。随着调查的深入，她发现了一种可能预防副作用的方法，但这需要她做出艰难的选择。\r\n\r\n第四部分：第三幕 在85岁时，陈嘉如面临着最终的对决，她必须在揭露真相和保护自己之间做出选择。她决定公开药物的副作用和阴谋，冒着生命危险将真相公之于众。最终，她成功地揭露了真相，并通过自己的研究找到了预防副作用的方法，帮助“迷失的一代”重新获得对生命的掌控，世界也因此发生了改变",
  "scores": {
    "Character Depth & Moral Dilemma Arc": 6,
    "Memory Anchors & Sensory Specificity": 4,
    "Intergenerational Span & Long-term Causality": 7,
    "Institutional & Tech Ethical Complexity": 5,
    "Investigative Drive & Clue Architecture": 6,
    "Multi-layered Conflict": 6,
    "Value Turns & Causal Cohesion": 7,
    "Hierarchy of Beats & Midpoint/Climax Design": 6,
    "Emotional Punch & Aftershock": 5,
    "Dual Resonance of Ending: Personal & Public": 7
  },
  "justifications": {
    "Character Depth & Moral Dilemma Arc": "Chen Jiaru's character is driven by a clear goal and faces a moral dilemma, but the internal transformation lacks depth. Her choices are significant, yet the narrative could further explore her internal conflict and transformation over time.",
    "Memory Anchors & Sensory Specificity": "The narrative lacks specific memory anchors or sensory details that recur to drive the plot or character decisions. The story could benefit from more vivid sensory descriptions to enhance emotional depth.",
    "Intergenerational Span & Long-term Causality": "The story effectively spans Chen Jiaru's life from 28 to 85, showing long-term consequences of the drug and her actions. However, the generational impact could be more explicitly detailed.",
    "Institutional & Tech Ethical Complexity": "The narrative presents a basic depiction of institutional actions but lacks depth in exploring the complexity of motives and ethical dilemmas within the government and scientific community.",
    "Investigative Drive & Clue Architecture": "Chen Jiaru's investigation drives the plot, with clues logically connected. However, the suspense and risks associated with evidence gathering could be more pronounced to enhance tension.",
    "Multi-layered Conflict": "The story includes internal, interpersonal, and extra-personal conflicts, but these layers could be more intricately woven to amplify the protagonist's challenges and choices.",
    "Value Turns & Causal Cohesion": "The narrative demonstrates clear value shifts, particularly in Chen Jiaru's journey from exclusion to empowerment. The causal chain is mostly coherent, though some transitions could be smoother.",
    "Hierarchy of Beats & Midpoint/Climax Design": "The story follows a clear structure with a significant climax, but the midpoint could be more transformative, and the escalation of stakes more gradual to enhance impact.",
    "Emotional Punch & Aftershock": "Key scenes have emotional potential, but the aftershocks of these emotions are not fully explored in subsequent actions or reflections, limiting their lasting impact.",
    "Dual Resonance of Ending: Personal & Public": "The ending addresses both personal and public dimensions, with Chen Jiaru achieving personal closure and societal change. However, the resolution could retain more ambiguity to reflect ongoing societal challenges."
  },
  "metrics": [
    {
      "name": "Character Depth & Moral Dilemma Arc",
      "score": 6,
      "justification": "Chen Jiaru's character is driven by a clear goal and faces a moral dilemma, but the internal transformation lacks depth. Her choices are significant, yet the narrative could further explore her internal conflict and transformation over time."
    },
    {
      "name": "Memory Anchors & Sensory Specificity",
      "score": 4,
      "justification": "The narrative lacks specific memory anchors or sensory details that recur to drive the plot or character decisions. The story could benefit from more vivid sensory descriptions to enhance emotional depth."
    },
    {
      "name": "Intergenerational Span & Long-term Causality",
      "score": 7,
      "justification": "The story effectively spans Chen Jiaru's life from 28 to 85, showing long-term consequences of the drug and her actions. However, the generational impact could be more explicitly detailed."
    },
    {
      "name": "Institutional & Tech Ethical Complexity",
      "score": 5,
      "justification": "The narrative presents a basic depiction of institutional actions but lacks depth in exploring the complexity of motives and ethical dilemmas within the government and scientific community."
    },
    {
      "name": "Investigative Drive & Clue Architecture",
      "score": 6,
      "justification": "Chen Jiaru's investigation drives the plot, with clues logically connected. However, the suspense and risks associated with evidence gathering could be more pronounced to enhance tension."
    },
    {
      "name": "Multi-layered Conflict",
      "score": 6,
      "justification": "The story includes internal, interpersonal, and extra-personal conflicts, but these layers could be more intricately woven to amplify the protagonist's challenges and choices."
    },
    {
      "name": "Value Turns & Causal Cohesion",
      "score": 7,
      "justification": "The narrative demonstrates clear value shifts, particularly in Chen Jiaru's journey from exclusion to empowerment. The causal chain is mostly coherent, though some transitions could be smoother."
    },
    {
      "name": "Hierarchy of Beats & Midpoint/Climax Design",
      "score": 6,
      "justification": "The story follows a clear structure with a significant climax, but the midpoint could be more transformative, and the escalation of stakes more gradual to enhance impact."
    },
    {
      "name": "Emotional Punch & Aftershock",
      "score": 5,
      "justification": "Key scenes have emotional potential, but the aftershocks of these emotions are not fully explored in subsequent actions or reflections, limiting their lasting impact."
    },
    {
      "name": "Dual Resonance of Ending: Personal & Public",
      "score": 7,
      "justification": "The ending addresses both personal and public dimensions, with Chen Jiaru achieving personal closure and societal change. However, the resolution could retain more ambiguity to reflect ongoing societal challenges."
    }
  ],
  "overall_summary": "The narrative presents a compelling story of Chen Jiaru, who navigates a world altered by a life-extending drug, uncovering its hidden dangers and ultimately redefining the meaning of life. The story effectively explores themes of exclusion, investigation, and moral choice, though it could benefit from deeper character development and more nuanced institutional complexity.",
  "total_score": 59,
  "ai_response": "===EVALUATION_START===\nOVERALL_SUMMARY: The narrative presents a compelling story of Chen Jiaru, who navigates a world altered by a life-extending drug, uncovering its hidden dangers and ultimately redefining the meaning of life. The story effectively explores themes of exclusion, investigation, and moral choice, though it could benefit from deeper character development and more nuanced institutional complexity.\n\nCRITERION_SCORES:\nCRITERION_1|Character Depth & Moral Dilemma Arc|6|Chen Jiaru's character is driven by a clear goal and faces a moral dilemma, but the internal transformation lacks depth. Her choices are significant, yet the narrative could further explore her internal conflict and transformation over time.\nCRITERION_2|Memory Anchors & Sensory Specificity|4|The narrative lacks specific memory anchors or sensory details that recur to drive the plot or character decisions. The story could benefit from more vivid sensory descriptions to enhance emotional depth.\nCRITERION_3|Intergenerational Span & Long-term Causality|7|The story effectively spans Chen Jiaru's life from 28 to 85, showing long-term consequences of the drug and her actions. However, the generational impact could be more explicitly detailed.\nCRITERION_4|Institutional & Tech Ethical Complexity|5|The narrative presents a basic depiction of institutional actions but lacks depth in exploring the complexity of motives and ethical dilemmas within the government and scientific community.\nCRITERION_5|Investigative Drive & Clue Architecture|6|Chen Jiaru's investigation drives the plot, with clues logically connected. However, the suspense and risks associated with evidence gathering could be more pronounced to enhance tension.\nCRITERION_6|Multi-layered Conflict|6|The story includes internal, interpersonal, and extra-personal conflicts, but these layers could be more intricately woven to amplify the protagonist's challenges and choices.\nCRITERION_7|Value Turns & Causal Cohesion|7|The narrative demonstrates clear value shifts, particularly in Chen Jiaru's journey from exclusion to empowerment. The causal chain is mostly coherent, though some transitions could be smoother.\nCRITERION_8|Hierarchy of Beats & Midpoint/Climax Design|6|The story follows a clear structure with a significant climax, but the midpoint could be more transformative, and the escalation of stakes more gradual to enhance impact.\nCRITERION_9|Emotional Punch & Aftershock|5|Key scenes have emotional potential, but the aftershocks of these emotions are not fully explored in subsequent actions or reflections, limiting their lasting impact.\nCRITERION_10|Dual Resonance of Ending: Personal & Public|7|The ending addresses both personal and public dimensions, with Chen Jiaru achieving personal closure and societal change. However, the resolution could retain more ambiguity to reflect ongoing societal challenges.\n===EVALUATION_END===",
  "created_at": "2025-08-31T15:29:04.365174+00:00"
}