{
  "user_name": "赵炳熙828-2",
  "user_group": "writing_b1",
  "user_group_display": "写作 B-1",
  "submitted_text": "第一部分：故事概括\r\n\r\n在一个永生药物引发社会动荡的未来世界，一位被排除在外的“迷失的一代”成员在85岁时发现药物的致命副作用，揭露政府决策的错误，并在重新审视生命的意义中找到了内心的平衡。\r\n\r\n第二部分：第一幕\r\n\r\n故事开始于主角28岁时，科学界宣布发现了一种能够阻止衰老的药物，但政府只将其提供给26岁以下的公民，主角和他的同龄人被排除在外，被称为“迷失的一代”。随着时间的推移，主角目睹了年轻一代的永生生活，而他自己则逐渐老去，心中充满了不甘与失落。当他85岁时，世界突然爆发了关于永生药物副作用的新闻，打破了他对永生的幻想，促使他开始质疑生命的真正价值。\r\n\r\n第三部分：第二幕\r\n\r\n在得知药物的副作用后，主角开始调查这些副作用的真相，并与其他“迷失的一代”成员联手，试图揭露真相并警告那些已经服用药物的人。他们面临着来自政府和药物公司强大的阻力，同时也要处理自己内心的矛盾：是继续追求永生，还是接受自然的生命进程。随着调查的深入，主角发现副作用不仅影响身体，还对人类的情感和社会结构造成了深远的影响，这让他意识到生命的有限性和珍贵性。\r\n\r\n第四部分：第三幕\r\n\r\n在最终的对决中，主角和他的盟友成功揭露了药物的真相，迫使政府承认错误并停止药物的分发。主角在这一过程中重新找到了生命的意义，接受了自己的衰老，并与年轻一代建立了新的联系。故事以主角在新平衡中的生活结束，他不再追求永生，而是珍惜每一个有限的时刻，体现了对生命本质的深刻理解。",
  "scores": {
    "Character Depth & Moral Dilemma Arc": 8,
    "Memory Anchors & Sensory Specificity": 6,
    "Intergenerational Span & Long-term Causality": 9,
    "Institutional & Tech Ethical Complexity": 7,
    "Investigative Drive & Clue Architecture": 7,
    "Multi-layered Conflict": 8,
    "Value Turns & Causal Cohesion": 8,
    "Hierarchy of Beats & Midpoint/Climax Design": 7,
    "Emotional Punch & Aftershock": 8,
    "Dual Resonance of Ending: Personal & Public": 9
  },
  "justifications": {
    "Character Depth & Moral Dilemma Arc": "The protagonist's journey from resentment to acceptance of life's natural limits is well-developed. The moral dilemma of choosing between eternal life and natural aging is driven by internal motivations and results in a significant transformation.",
    "Memory Anchors & Sensory Specificity": "While the narrative lacks specific recurring sensory details, the protagonist's memories and reflections on aging serve as effective anchors for his emotional journey.",
    "Intergenerational Span & Long-term Causality": "The story effectively contrasts the protagonist's aging with the eternal youth of the younger generation, highlighting the long-term societal and personal consequences of the drug.",
    "Institutional & Tech Ethical Complexity": "The depiction of government and corporate interests is multifaceted, with their motivations and actions directly impacting the protagonist's choices. However, more specific institutional details could enhance the complexity.",
    "Investigative Drive & Clue Architecture": "The protagonist's investigation into the drug's side effects is a central plotline, with logical progression and rising stakes. However, the narrative could benefit from more detailed clues and risks.",
    "Multi-layered Conflict": "The story presents conflicts on internal, interpersonal, and societal levels, which are well-integrated and drive the protagonist's transformation.",
    "Value Turns & Causal Cohesion": "Each act introduces significant value shifts, such as the protagonist's changing perception of life and death, with clear causal links between events.",
    "Hierarchy of Beats & Midpoint/Climax Design": "The narrative structure is clear, with escalating tension leading to a climax that resolves the central conflict. However, the midpoint could introduce a more dramatic rule change.",
    "Emotional Punch & Aftershock": "Key scenes, particularly the revelation of the drug's side effects, deliver strong emotional impact and have lasting effects on the protagonist's worldview.",
    "Dual Resonance of Ending: Personal & Public": "The ending achieves both personal closure for the protagonist and societal change, with the government acknowledging its mistakes. It maintains moral ambiguity by highlighting the ongoing value of finite life."
  },
  "metrics": [
    {
      "name": "Character Depth & Moral Dilemma Arc",
      "score": 8,
      "justification": "The protagonist's journey from resentment to acceptance of life's natural limits is well-developed. The moral dilemma of choosing between eternal life and natural aging is driven by internal motivations and results in a significant transformation."
    },
    {
      "name": "Memory Anchors & Sensory Specificity",
      "score": 6,
      "justification": "While the narrative lacks specific recurring sensory details, the protagonist's memories and reflections on aging serve as effective anchors for his emotional journey."
    },
    {
      "name": "Intergenerational Span & Long-term Causality",
      "score": 9,
      "justification": "The story effectively contrasts the protagonist's aging with the eternal youth of the younger generation, highlighting the long-term societal and personal consequences of the drug."
    },
    {
      "name": "Institutional & Tech Ethical Complexity",
      "score": 7,
      "justification": "The depiction of government and corporate interests is multifaceted, with their motivations and actions directly impacting the protagonist's choices. However, more specific institutional details could enhance the complexity."
    },
    {
      "name": "Investigative Drive & Clue Architecture",
      "score": 7,
      "justification": "The protagonist's investigation into the drug's side effects is a central plotline, with logical progression and rising stakes. However, the narrative could benefit from more detailed clues and risks."
    },
    {
      "name": "Multi-layered Conflict",
      "score": 8,
      "justification": "The story presents conflicts on internal, interpersonal, and societal levels, which are well-integrated and drive the protagonist's transformation."
    },
    {
      "name": "Value Turns & Causal Cohesion",
      "score": 8,
      "justification": "Each act introduces significant value shifts, such as the protagonist's changing perception of life and death, with clear causal links between events."
    },
    {
      "name": "Hierarchy of Beats & Midpoint/Climax Design",
      "score": 7,
      "justification": "The narrative structure is clear, with escalating tension leading to a climax that resolves the central conflict. However, the midpoint could introduce a more dramatic rule change."
    },
    {
      "name": "Emotional Punch & Aftershock",
      "score": 8,
      "justification": "Key scenes, particularly the revelation of the drug's side effects, deliver strong emotional impact and have lasting effects on the protagonist's worldview."
    },
    {
      "name": "Dual Resonance of Ending: Personal & Public",
      "score": 9,
      "justification": "The ending achieves both personal closure for the protagonist and societal change, with the government acknowledging its mistakes. It maintains moral ambiguity by highlighting the ongoing value of finite life."
    }
  ],
  "overall_summary": "The narrative presents a compelling exploration of a dystopian future where a drug promising eternal life leads to societal upheaval. The protagonist, part of a \"lost generation\" excluded from the benefits of this drug, undergoes a profound personal transformation upon discovering its fatal side effects. The story effectively intertwines personal and societal conflicts, culminating in a resolution that emphasizes the value of finite life.",
  "total_score": 77,
  "ai_response": "===EVALUATION_START===\nOVERALL_SUMMARY: The narrative presents a compelling exploration of a dystopian future where a drug promising eternal life leads to societal upheaval. The protagonist, part of a \"lost generation\" excluded from the benefits of this drug, undergoes a profound personal transformation upon discovering its fatal side effects. The story effectively intertwines personal and societal conflicts, culminating in a resolution that emphasizes the value of finite life.\n\nCRITERION_SCORES:\nCRITERION_1|Character Depth & Moral Dilemma Arc|8|The protagonist's journey from resentment to acceptance of life's natural limits is well-developed. The moral dilemma of choosing between eternal life and natural aging is driven by internal motivations and results in a significant transformation.\nCRITERION_2|Memory Anchors & Sensory Specificity|6|While the narrative lacks specific recurring sensory details, the protagonist's memories and reflections on aging serve as effective anchors for his emotional journey.\nCRITERION_3|Intergenerational Span & Long-term Causality|9|The story effectively contrasts the protagonist's aging with the eternal youth of the younger generation, highlighting the long-term societal and personal consequences of the drug.\nCRITERION_4|Institutional & Tech Ethical Complexity|7|The depiction of government and corporate interests is multifaceted, with their motivations and actions directly impacting the protagonist's choices. However, more specific institutional details could enhance the complexity.\nCRITERION_5|Investigative Drive & Clue Architecture|7|The protagonist's investigation into the drug's side effects is a central plotline, with logical progression and rising stakes. However, the narrative could benefit from more detailed clues and risks.\nCRITERION_6|Multi-layered Conflict|8|The story presents conflicts on internal, interpersonal, and societal levels, which are well-integrated and drive the protagonist's transformation.\nCRITERION_7|Value Turns & Causal Cohesion|8|Each act introduces significant value shifts, such as the protagonist's changing perception of life and death, with clear causal links between events.\nCRITERION_8|Hierarchy of Beats & Midpoint/Climax Design|7|The narrative structure is clear, with escalating tension leading to a climax that resolves the central conflict. However, the midpoint could introduce a more dramatic rule change.\nCRITERION_9|Emotional Punch & Aftershock|8|Key scenes, particularly the revelation of the drug's side effects, deliver strong emotional impact and have lasting effects on the protagonist's worldview.\nCRITERION_10|Dual Resonance of Ending: Personal & Public|9|The ending achieves both personal closure for the protagonist and societal change, with the government acknowledging its mistakes. It maintains moral ambiguity by highlighting the ongoing value of finite life.\n===EVALUATION_END===",
  "created_at": "2025-08-28T13:14:50.792477+00:00"
}