{
  "user_name": "t-n",
  "user_group": "writing_b2",
  "user_group_display": "写作 B-2",
  "submitted_text": "第一部分：故事概括\r\n\r\n在一个因永生药物引发社会不平等的未来，85岁的主角揭露药物的致命副作用，挑战不公制度，唤醒被遗忘的“迷失的一代”，最终推动社会变革，呼唤人们重新审视生命的真正价值。\r\n第二部分：第一幕\r\n\r\n故事开始于主角28岁时，科学界宣布发现一种能阻止衰老的药物，但政府只将其提供给26岁以下的公民，主角和“迷失的一代”被排除在外。面对教育、医疗、住房等方面的巨大压力，政府推出永生药物作为缓解社会矛盾的解决方案，然而，主角心怀不满却无能为力，只能看着年轻一代享受永生的特权。随着时间推移，主角逐渐接受了自己的命运，直到85岁时，药物的副作用开始显现，年轻一代的健康状况急剧恶化，社会陷入恐慌。\r\n第三部分：第二幕\r\n\r\n主角意识到这是揭露真相的机会，他开始调查药物的真实影响，并与其他“迷失的一代”成员联手，收集证据。随着调查深入，主角发现政府和制药公司早已知晓副作用，却选择隐瞒真相以维持权力和利益。药物的副作用不仅导致身体机能的崩溃，还引发了严重的心理问题，年轻一代的精神状态逐渐恶化。主角面临内心的挣扎，是否要冒险揭露真相，最终在一次公共演讲中，他勇敢地揭示了药物的危害，引发社会的广泛关注和抗议。\r\n第四部分：第三幕\r\n\r\n在社会动荡中，主角和他的盟友们面临来自政府和制药公司的强烈反击，但他们坚定不移，继续推动真相的传播。最终，随着越来越多的证据曝光，政府被迫承认错误，停止药物的分发，并开始研究解决方案。主角在这一过程中找到了内心的平衡，虽然无法获得永生，但他通过自己的努力改变了社会的不公，迎来了一个更加公平的未来。结尾处，人们开始反思生命的意义，意识到真正的永生在于对生命价值的理解和珍惜。",
  "scores": {
    "Character Depth & Moral Dilemma Arc": 7,
    "Memory Anchors & Sensory Specificity": 5,
    "Intergenerational Span & Long-term Causality": 8,
    "Institutional & Tech Ethical Complexity": 6,
    "Investigative Drive & Clue Architecture": 7,
    "Multi-layered Conflict": 7,
    "Value Turns & Causal Cohesion": 8,
    "Hierarchy of Beats & Midpoint/Climax Design": 7,
    "Emotional Punch & Aftershock": 6,
    "Dual Resonance of Ending: Personal & Public": 8
  },
  "justifications": {
    "Character Depth & Moral Dilemma Arc": "The protagonist's journey from acceptance of his fate to active resistance against societal injustice provides a solid moral dilemma arc. However, the internal reasoning and transformation could be more deeply explored to enhance emotional resonance.",
    "Memory Anchors & Sensory Specificity": "While the narrative hints at the protagonist's past and present, it lacks specific sensory details or recurring memory anchors that could enrich the emotional depth and drive character decisions more effectively.",
    "Intergenerational Span & Long-term Causality": "The story effectively uses an intergenerational timeline, contrasting the protagonist's youth with his old age, and showing the long-term consequences of societal decisions on different generations.",
    "Institutional & Tech Ethical Complexity": "The narrative presents the government and pharmaceutical company as antagonists but could benefit from a more nuanced portrayal of their motives and ethical complexities to avoid a purely villainous depiction.",
    "Investigative Drive & Clue Architecture": "The protagonist's investigation into the drug's effects is well-structured, with a logical progression of evidence gathering, though the rising costs and suspense could be more pronounced.",
    "Multi-layered Conflict": "The story includes internal, interpersonal, and extra-personal conflicts, particularly the protagonist's internal struggle and societal pressures, but could further interconnect these layers to amplify tension.",
    "Value Turns & Causal Cohesion": "The narrative effectively uses value shifts, such as from acceptance to rebellion, and maintains causal cohesion, with each event logically leading to the next and contributing to the protagonist's transformation.",
    "Hierarchy of Beats & Midpoint/Climax Design": "The story's structure is clear, with a significant midpoint where the protagonist decides to reveal the truth, leading to a climactic societal upheaval. However, the escalation could be more intense.",
    "Emotional Punch & Aftershock": "Key scenes, such as the public revelation, have emotional impact, but the aftershocks and long-term emotional effects on the protagonist and society could be more deeply explored.",
    "Dual Resonance of Ending: Personal & Public": "The ending successfully addresses both personal and public dimensions, with the protagonist finding inner peace and society beginning to reflect on life's true value, though it could retain more moral ambiguity."
  },
  "metrics": [
    {
      "name": "Character Depth & Moral Dilemma Arc",
      "score": 7,
      "justification": "The protagonist's journey from acceptance of his fate to active resistance against societal injustice provides a solid moral dilemma arc. However, the internal reasoning and transformation could be more deeply explored to enhance emotional resonance."
    },
    {
      "name": "Memory Anchors & Sensory Specificity",
      "score": 5,
      "justification": "While the narrative hints at the protagonist's past and present, it lacks specific sensory details or recurring memory anchors that could enrich the emotional depth and drive character decisions more effectively."
    },
    {
      "name": "Intergenerational Span & Long-term Causality",
      "score": 8,
      "justification": "The story effectively uses an intergenerational timeline, contrasting the protagonist's youth with his old age, and showing the long-term consequences of societal decisions on different generations."
    },
    {
      "name": "Institutional & Tech Ethical Complexity",
      "score": 6,
      "justification": "The narrative presents the government and pharmaceutical company as antagonists but could benefit from a more nuanced portrayal of their motives and ethical complexities to avoid a purely villainous depiction."
    },
    {
      "name": "Investigative Drive & Clue Architecture",
      "score": 7,
      "justification": "The protagonist's investigation into the drug's effects is well-structured, with a logical progression of evidence gathering, though the rising costs and suspense could be more pronounced."
    },
    {
      "name": "Multi-layered Conflict",
      "score": 7,
      "justification": "The story includes internal, interpersonal, and extra-personal conflicts, particularly the protagonist's internal struggle and societal pressures, but could further interconnect these layers to amplify tension."
    },
    {
      "name": "Value Turns & Causal Cohesion",
      "score": 8,
      "justification": "The narrative effectively uses value shifts, such as from acceptance to rebellion, and maintains causal cohesion, with each event logically leading to the next and contributing to the protagonist's transformation."
    },
    {
      "name": "Hierarchy of Beats & Midpoint/Climax Design",
      "score": 7,
      "justification": "The story's structure is clear, with a significant midpoint where the protagonist decides to reveal the truth, leading to a climactic societal upheaval. However, the escalation could be more intense."
    },
    {
      "name": "Emotional Punch & Aftershock",
      "score": 6,
      "justification": "Key scenes, such as the public revelation, have emotional impact, but the aftershocks and long-term emotional effects on the protagonist and society could be more deeply explored."
    },
    {
      "name": "Dual Resonance of Ending: Personal & Public",
      "score": 8,
      "justification": "The ending successfully addresses both personal and public dimensions, with the protagonist finding inner peace and society beginning to reflect on life's true value, though it could retain more moral ambiguity."
    }
  ],
  "overall_summary": "The narrative presents a compelling story set in a dystopian future where a protagonist from the \"lost generation\" challenges societal inequalities caused by a life-extending drug. The story effectively explores themes of moral courage, societal change, and the true value of life, though it could benefit from more nuanced character development and deeper exploration of institutional complexities.",
  "total_score": 69,
  "ai_response": "===EVALUATION_START===\nOVERALL_SUMMARY: The narrative presents a compelling story set in a dystopian future where a protagonist from the \"lost generation\" challenges societal inequalities caused by a life-extending drug. The story effectively explores themes of moral courage, societal change, and the true value of life, though it could benefit from more nuanced character development and deeper exploration of institutional complexities.\n\nCRITERION_SCORES:\nCRITERION_1|Character Depth & Moral Dilemma Arc|7|The protagonist's journey from acceptance of his fate to active resistance against societal injustice provides a solid moral dilemma arc. However, the internal reasoning and transformation could be more deeply explored to enhance emotional resonance.\nCRITERION_2|Memory Anchors & Sensory Specificity|5|While the narrative hints at the protagonist's past and present, it lacks specific sensory details or recurring memory anchors that could enrich the emotional depth and drive character decisions more effectively.\nCRITERION_3|Intergenerational Span & Long-term Causality|8|The story effectively uses an intergenerational timeline, contrasting the protagonist's youth with his old age, and showing the long-term consequences of societal decisions on different generations.\nCRITERION_4|Institutional & Tech Ethical Complexity|6|The narrative presents the government and pharmaceutical company as antagonists but could benefit from a more nuanced portrayal of their motives and ethical complexities to avoid a purely villainous depiction.\nCRITERION_5|Investigative Drive & Clue Architecture|7|The protagonist's investigation into the drug's effects is well-structured, with a logical progression of evidence gathering, though the rising costs and suspense could be more pronounced.\nCRITERION_6|Multi-layered Conflict|7|The story includes internal, interpersonal, and extra-personal conflicts, particularly the protagonist's internal struggle and societal pressures, but could further interconnect these layers to amplify tension.\nCRITERION_7|Value Turns & Causal Cohesion|8|The narrative effectively uses value shifts, such as from acceptance to rebellion, and maintains causal cohesion, with each event logically leading to the next and contributing to the protagonist's transformation.\nCRITERION_8|Hierarchy of Beats & Midpoint/Climax Design|7|The story's structure is clear, with a significant midpoint where the protagonist decides to reveal the truth, leading to a climactic societal upheaval. However, the escalation could be more intense.\nCRITERION_9|Emotional Punch & Aftershock|6|Key scenes, such as the public revelation, have emotional impact, but the aftershocks and long-term emotional effects on the protagonist and society could be more deeply explored.\nCRITERION_10|Dual Resonance of Ending: Personal & Public|8|The ending successfully addresses both personal and public dimensions, with the protagonist finding inner peace and society beginning to reflect on life's true value, though it could retain more moral ambiguity.\n===EVALUATION_END===",
  "created_at": "2025-08-31T15:29:39.012244+00:00"
}