{
  "user_name": "test1",
  "user_group": "writing_b1",
  "user_group_display": "写作 B-1",
  "submitted_text": "第一部分：故事概括\r\n在一个永生药物改变人类命运的世界中，一位被排除在外的“迷失的一代”成员在85岁时发现药物的致命副作用，他在揭露真相的过程中，面临着保护自己享受永生药物的后代的艰难选择，最终揭示出人性复杂却充满希望的本质。\r\n\r\n第二部分：第一幕\r\n故事开始于主角28岁时，科学家宣布发现一种可以阻止衰老的药物，政府决定只提供给26岁以下的公民，主角和他的同龄人被称为“迷失的一代”，被排除在外。随着时间的推移，主角目睹自己的孩子享受永生的特权，而他自己则逐渐老去，心中充满不甘与失落。当他85岁时，主角偶然发现永生药物的副作用正在悄然显现，威胁着所有使用者的生命。\r\n\r\n第三部分：第二幕\r\n主角开始调查药物的真相，发现政府早已知晓副作用却选择隐瞒，为了保护自己的利益。随着调查的深入，他结识了一群同样被排除在外的“迷失的一代”成员，他们决定联手揭露真相。在这个过程中，主角面临来自政府的威胁和内心的挣扎，他必须在揭露真相和保护自己享受永生药物的后代之间做出艰难选择。随着时间的推移，药物的副作用愈发明显，社会开始动荡不安，而他的后代也因担心而与他产生冲突，但最终选择支持他的决定。\r\n\r\n第四部分：第三幕\r\n在最终对决中，主角和他的盟友们成功揭露了药物的真相，迫使政府公开承认错误并停止药物的分发。已经使用药物的人面临着逐渐失去永生效果的恐慌和健康问题的威胁，社会陷入混乱。尽管这一胜利来之不易，但主角意识到人类对永生的追求终究无法逃避自然规律。他选择回归平凡的生活，珍惜有限的时光，与家人和朋友共度余生。主角与后代在经历了风雨后更加珍惜彼此，故事以主角的内心平和结束，展现出在复杂的人性中仍然存在希望与爱的力量。",
  "scores": {
    "Character Depth & Moral Dilemma Arc": 7,
    "Memory Anchors & Sensory Specificity": 5,
    "Intergenerational Span & Long-term Causality": 8,
    "Institutional & Tech Ethical Complexity": 6,
    "Investigative Drive & Clue Architecture": 7,
    "Multi-layered Conflict": 8,
    "Value Turns & Causal Cohesion": 7,
    "Hierarchy of Beats & Midpoint/Climax Design": 7,
    "Emotional Punch & Aftershock": 6,
    "Dual Resonance of Ending: Personal & Public": 8
  },
  "justifications": {
    "Character Depth & Moral Dilemma Arc": "The protagonist faces a significant moral dilemma between revealing the truth and protecting his descendants, leading to an internal transformation. However, the internal reasoning behind his choices could be more deeply explored.",
    "Memory Anchors & Sensory Specificity": "While the narrative mentions the protagonist's age and experiences, it lacks recurring sensory details or specific memory anchors that drive emotional or cognitive changes.",
    "Intergenerational Span & Long-term Causality": "The story effectively uses intergenerational timelines and consequences, highlighting the protagonist's aging and his children's experiences with the immortality drug, creating a strong contrast between generations.",
    "Institutional & Tech Ethical Complexity": "The government is depicted as concealing the drug's side effects for self-interest, but the institutional motives could be more nuanced, showing a mix of ideals and fears rather than a purely villainous portrayal.",
    "Investigative Drive & Clue Architecture": "The protagonist's investigation into the drug's side effects drives the plot, with logical connections and rising tension. However, the risks and costs associated with evidence gathering could be more pronounced.",
    "Multi-layered Conflict": "The narrative presents internal, interpersonal, and extra-personal conflicts, including the protagonist's internal struggle, family disputes, and societal turmoil, effectively interconnecting these layers to amplify tension.",
    "Value Turns & Causal Cohesion": "The story includes recognizable value shifts, such as trust to suspicion, and these shifts are causally linked. However, some transitions could be more explicitly detailed to avoid reliance on coincidence.",
    "Hierarchy of Beats & Midpoint/Climax Design": "The narrative structure includes a clear midpoint and climax, with escalating pressure and irreversible changes. The climax delivers a significant societal shift, though the hierarchy of beats could be more distinct.",
    "Emotional Punch & Aftershock": "Key scenes, such as the revelation of the drug's side effects, have emotional impact, but the aftershocks could be more thoroughly explored in subsequent actions and memories.",
    "Dual Resonance of Ending: Personal & Public": "The ending resonates on both personal and public levels, addressing the protagonist's emotional closure and societal issues, while maintaining moral ambiguity and openness."
  },
  "metrics": [
    {
      "name": "Character Depth & Moral Dilemma Arc",
      "score": 7,
      "justification": "The protagonist faces a significant moral dilemma between revealing the truth and protecting his descendants, leading to an internal transformation. However, the internal reasoning behind his choices could be more deeply explored."
    },
    {
      "name": "Memory Anchors & Sensory Specificity",
      "score": 5,
      "justification": "While the narrative mentions the protagonist's age and experiences, it lacks recurring sensory details or specific memory anchors that drive emotional or cognitive changes."
    },
    {
      "name": "Intergenerational Span & Long-term Causality",
      "score": 8,
      "justification": "The story effectively uses intergenerational timelines and consequences, highlighting the protagonist's aging and his children's experiences with the immortality drug, creating a strong contrast between generations."
    },
    {
      "name": "Institutional & Tech Ethical Complexity",
      "score": 6,
      "justification": "The government is depicted as concealing the drug's side effects for self-interest, but the institutional motives could be more nuanced, showing a mix of ideals and fears rather than a purely villainous portrayal."
    },
    {
      "name": "Investigative Drive & Clue Architecture",
      "score": 7,
      "justification": "The protagonist's investigation into the drug's side effects drives the plot, with logical connections and rising tension. However, the risks and costs associated with evidence gathering could be more pronounced."
    },
    {
      "name": "Multi-layered Conflict",
      "score": 8,
      "justification": "The narrative presents internal, interpersonal, and extra-personal conflicts, including the protagonist's internal struggle, family disputes, and societal turmoil, effectively interconnecting these layers to amplify tension."
    },
    {
      "name": "Value Turns & Causal Cohesion",
      "score": 7,
      "justification": "The story includes recognizable value shifts, such as trust to suspicion, and these shifts are causally linked. However, some transitions could be more explicitly detailed to avoid reliance on coincidence."
    },
    {
      "name": "Hierarchy of Beats & Midpoint/Climax Design",
      "score": 7,
      "justification": "The narrative structure includes a clear midpoint and climax, with escalating pressure and irreversible changes. The climax delivers a significant societal shift, though the hierarchy of beats could be more distinct."
    },
    {
      "name": "Emotional Punch & Aftershock",
      "score": 6,
      "justification": "Key scenes, such as the revelation of the drug's side effects, have emotional impact, but the aftershocks could be more thoroughly explored in subsequent actions and memories."
    },
    {
      "name": "Dual Resonance of Ending: Personal & Public",
      "score": 8,
      "justification": "The ending resonates on both personal and public levels, addressing the protagonist's emotional closure and societal issues, while maintaining moral ambiguity and openness."
    }
  ],
  "overall_summary": "The narrative presents a compelling exploration of the ethical implications of a world altered by an immortality drug, focusing on the protagonist's moral dilemma and the societal upheaval that ensues. The story effectively intertwines personal and public stakes, though some elements could benefit from deeper exploration, particularly in terms of character development and institutional complexity.",
  "total_score": 69,
  "ai_response": "===EVALUATION_START===\nOVERALL_SUMMARY: The narrative presents a compelling exploration of the ethical implications of a world altered by an immortality drug, focusing on the protagonist's moral dilemma and the societal upheaval that ensues. The story effectively intertwines personal and public stakes, though some elements could benefit from deeper exploration, particularly in terms of character development and institutional complexity.\n\nCRITERION_SCORES:\nCRITERION_1|Character Depth & Moral Dilemma Arc|7|The protagonist faces a significant moral dilemma between revealing the truth and protecting his descendants, leading to an internal transformation. However, the internal reasoning behind his choices could be more deeply explored.\nCRITERION_2|Memory Anchors & Sensory Specificity|5|While the narrative mentions the protagonist's age and experiences, it lacks recurring sensory details or specific memory anchors that drive emotional or cognitive changes.\nCRITERION_3|Intergenerational Span & Long-term Causality|8|The story effectively uses intergenerational timelines and consequences, highlighting the protagonist's aging and his children's experiences with the immortality drug, creating a strong contrast between generations.\nCRITERION_4|Institutional & Tech Ethical Complexity|6|The government is depicted as concealing the drug's side effects for self-interest, but the institutional motives could be more nuanced, showing a mix of ideals and fears rather than a purely villainous portrayal.\nCRITERION_5|Investigative Drive & Clue Architecture|7|The protagonist's investigation into the drug's side effects drives the plot, with logical connections and rising tension. However, the risks and costs associated with evidence gathering could be more pronounced.\nCRITERION_6|Multi-layered Conflict|8|The narrative presents internal, interpersonal, and extra-personal conflicts, including the protagonist's internal struggle, family disputes, and societal turmoil, effectively interconnecting these layers to amplify tension.\nCRITERION_7|Value Turns & Causal Cohesion|7|The story includes recognizable value shifts, such as trust to suspicion, and these shifts are causally linked. However, some transitions could be more explicitly detailed to avoid reliance on coincidence.\nCRITERION_8|Hierarchy of Beats & Midpoint/Climax Design|7|The narrative structure includes a clear midpoint and climax, with escalating pressure and irreversible changes. The climax delivers a significant societal shift, though the hierarchy of beats could be more distinct.\nCRITERION_9|Emotional Punch & Aftershock|6|Key scenes, such as the revelation of the drug's side effects, have emotional impact, but the aftershocks could be more thoroughly explored in subsequent actions and memories.\nCRITERION_10|Dual Resonance of Ending: Personal & Public|8|The ending resonates on both personal and public levels, addressing the protagonist's emotional closure and societal issues, while maintaining moral ambiguity and openness.\n===EVALUATION_END===",
  "created_at": "2025-08-28T12:59:22.216333+00:00"
}