{
  "user_name": "tt2",
  "user_group": "writing_b2",
  "user_group_display": "写作 B-2",
  "submitted_text": "第一部分：故事概括\r\n在一个因永生药物而改变命运的世界中，主角通过对弟弟的嫉恨和自我无能的叹息，最终在弟弟因药物副作用崩溃前的独白和回忆中，发现了“塞翁失马焉知非福”的真理，接受了自己的独特价值。\r\n\r\n第二部分：第一幕\r\n故事开始于主角28岁时，永生药物的发现让他与弟弟的命运分道扬镳，弟弟因年龄合适而获得永生，主角则被排除在外，成为“迷失的一代”。在成长过程中，主角一直生活在弟弟的阴影下，嫉妒和自卑交织。激励事件发生在主角85岁时，永生药物的副作用被揭示，弟弟因无法入眠而精神崩溃，主角在看着被束缚住却还在试图撕咬挣扎的弟弟时，内心复杂地开始回忆。\r\n\r\n第三部分：第二幕\r\n主角在面对弟弟的痛苦时，内心的嫉恨和自我否定达到顶峰，他开始回忆两人共同经历的成长节点，从特长比赛到青梅竹马的选择，再到职业发展，弟弟的成功与自己的失落不断重现。随着弟弟的精神状态恶化，主角意识到自己一直以来的嫉妒是多么无谓，他开始尝试与弟弟和解，并在过程中发现自己的生活虽然没有永生，却充满了真实的幸福和成就。\r\n\r\n第四部分：第三幕\r\n在最终对决中，主角面对弟弟的痛苦，意识到自己无法真正帮助他，最终在医生递过来的安乐死文件上签署了自己的名字，长长地叹息，接受了自己的命运，理解了“塞翁失马焉知非福”的真理，世界也因他的改变而变得更加平衡。",
  "scores": {
    "Character Depth & Moral Dilemma Arc": 7,
    "Memory Anchors & Sensory Specificity": 6,
    "Intergenerational Span & Long-term Causality": 8,
    "Institutional & Tech Ethical Complexity": 5,
    "Investigative Drive & Clue Architecture": 3,
    "Multi-layered Conflict": 7,
    "Value Turns & Causal Cohesion": 8,
    "Hierarchy of Beats & Midpoint/Climax Design": 6,
    "Emotional Punch & Aftershock": 7,
    "Dual Resonance of Ending: Personal & Public": 6
  },
  "justifications": {
    "Character Depth & Moral Dilemma Arc": "The protagonist's arc from jealousy to acceptance is clear, driven by internal motivations and reflections on his brother's fate. The moral dilemma of signing the euthanasia document is impactful, though the transformation could be more deeply explored.",
    "Memory Anchors & Sensory Specificity": "Memories of shared experiences serve as anchors, but sensory details are limited. Emotional changes are evident, though more specific sensory descriptions would enhance the narrative.",
    "Intergenerational Span & Long-term Causality": "The narrative effectively contrasts the protagonist's life at different ages, showing the long-term impact of the drug on his brother and his own acceptance of life's value. Time markers are clear and impactful.",
    "Institutional & Tech Ethical Complexity": "The story mentions the life-extending drug but lacks detailed exploration of the institutions behind it. The ethical complexity of the drug's impact is touched upon but not deeply examined.",
    "Investigative Drive & Clue Architecture": "The narrative does not focus on investigation or clue gathering. The revelation of the drug's side effects is presented without a layered investigative process.",
    "Multi-layered Conflict": "The protagonist's internal conflict, his relationship with his brother, and the societal impact of the drug create multi-layered conflict. These elements are interconnected, though the societal layer could be more developed.",
    "Value Turns & Causal Cohesion": "The protagonist's shift from envy to acceptance is well-motivated, with clear causal links between his reflections and actions. The narrative avoids random coincidences, maintaining cohesion.",
    "Hierarchy of Beats & Midpoint/Climax Design": "The narrative structure is clear, with a significant midpoint revelation and climax. However, the escalation of tension could be more pronounced to enhance the climax's impact.",
    "Emotional Punch & Aftershock": "The protagonist's emotional journey is impactful, particularly in the climax. The emotional resonance is maintained through reflections and decisions, though further aftershocks could deepen the impact.",
    "Dual Resonance of Ending: Personal & Public": "The ending provides personal closure for the protagonist, but the societal implications are less explored. The balance between personal acceptance and societal change could be more nuanced."
  },
  "metrics": [
    {
      "name": "Character Depth & Moral Dilemma Arc",
      "score": 7,
      "justification": "The protagonist's arc from jealousy to acceptance is clear, driven by internal motivations and reflections on his brother's fate. The moral dilemma of signing the euthanasia document is impactful, though the transformation could be more deeply explored."
    },
    {
      "name": "Memory Anchors & Sensory Specificity",
      "score": 6,
      "justification": "Memories of shared experiences serve as anchors, but sensory details are limited. Emotional changes are evident, though more specific sensory descriptions would enhance the narrative."
    },
    {
      "name": "Intergenerational Span & Long-term Causality",
      "score": 8,
      "justification": "The narrative effectively contrasts the protagonist's life at different ages, showing the long-term impact of the drug on his brother and his own acceptance of life's value. Time markers are clear and impactful."
    },
    {
      "name": "Institutional & Tech Ethical Complexity",
      "score": 5,
      "justification": "The story mentions the life-extending drug but lacks detailed exploration of the institutions behind it. The ethical complexity of the drug's impact is touched upon but not deeply examined."
    },
    {
      "name": "Investigative Drive & Clue Architecture",
      "score": 3,
      "justification": "The narrative does not focus on investigation or clue gathering. The revelation of the drug's side effects is presented without a layered investigative process."
    },
    {
      "name": "Multi-layered Conflict",
      "score": 7,
      "justification": "The protagonist's internal conflict, his relationship with his brother, and the societal impact of the drug create multi-layered conflict. These elements are interconnected, though the societal layer could be more developed."
    },
    {
      "name": "Value Turns & Causal Cohesion",
      "score": 8,
      "justification": "The protagonist's shift from envy to acceptance is well-motivated, with clear causal links between his reflections and actions. The narrative avoids random coincidences, maintaining cohesion."
    },
    {
      "name": "Hierarchy of Beats & Midpoint/Climax Design",
      "score": 6,
      "justification": "The narrative structure is clear, with a significant midpoint revelation and climax. However, the escalation of tension could be more pronounced to enhance the climax's impact."
    },
    {
      "name": "Emotional Punch & Aftershock",
      "score": 7,
      "justification": "The protagonist's emotional journey is impactful, particularly in the climax. The emotional resonance is maintained through reflections and decisions, though further aftershocks could deepen the impact."
    },
    {
      "name": "Dual Resonance of Ending: Personal & Public",
      "score": 6,
      "justification": "The ending provides personal closure for the protagonist, but the societal implications are less explored. The balance between personal acceptance and societal change could be more nuanced."
    }
  ],
  "overall_summary": "The narrative explores themes of envy, self-worth, and acceptance in a world altered by a life-extending drug. The protagonist's journey from jealousy to acceptance is portrayed through his relationship with his brother, who suffers from the drug's side effects. The story effectively uses memory and generational contrasts to highlight the protagonist's transformation, though it lacks depth in institutional complexity and investigative elements.",
  "total_score": 63,
  "ai_response": "===EVALUATION_START===\nOVERALL_SUMMARY: The narrative explores themes of envy, self-worth, and acceptance in a world altered by a life-extending drug. The protagonist's journey from jealousy to acceptance is portrayed through his relationship with his brother, who suffers from the drug's side effects. The story effectively uses memory and generational contrasts to highlight the protagonist's transformation, though it lacks depth in institutional complexity and investigative elements.\n\nCRITERION_SCORES:\nCRITERION_1|Character Depth & Moral Dilemma Arc|7|The protagonist's arc from jealousy to acceptance is clear, driven by internal motivations and reflections on his brother's fate. The moral dilemma of signing the euthanasia document is impactful, though the transformation could be more deeply explored.\nCRITERION_2|Memory Anchors & Sensory Specificity|6|Memories of shared experiences serve as anchors, but sensory details are limited. Emotional changes are evident, though more specific sensory descriptions would enhance the narrative.\nCRITERION_3|Intergenerational Span & Long-term Causality|8|The narrative effectively contrasts the protagonist's life at different ages, showing the long-term impact of the drug on his brother and his own acceptance of life's value. Time markers are clear and impactful.\nCRITERION_4|Institutional & Tech Ethical Complexity|5|The story mentions the life-extending drug but lacks detailed exploration of the institutions behind it. The ethical complexity of the drug's impact is touched upon but not deeply examined.\nCRITERION_5|Investigative Drive & Clue Architecture|3|The narrative does not focus on investigation or clue gathering. The revelation of the drug's side effects is presented without a layered investigative process.\nCRITERION_6|Multi-layered Conflict|7|The protagonist's internal conflict, his relationship with his brother, and the societal impact of the drug create multi-layered conflict. These elements are interconnected, though the societal layer could be more developed.\nCRITERION_7|Value Turns & Causal Cohesion|8|The protagonist's shift from envy to acceptance is well-motivated, with clear causal links between his reflections and actions. The narrative avoids random coincidences, maintaining cohesion.\nCRITERION_8|Hierarchy of Beats & Midpoint/Climax Design|6|The narrative structure is clear, with a significant midpoint revelation and climax. However, the escalation of tension could be more pronounced to enhance the climax's impact.\nCRITERION_9|Emotional Punch & Aftershock|7|The protagonist's emotional journey is impactful, particularly in the climax. The emotional resonance is maintained through reflections and decisions, though further aftershocks could deepen the impact.\nCRITERION_10|Dual Resonance of Ending: Personal & Public|6|The ending provides personal closure for the protagonist, but the societal implications are less explored. The balance between personal acceptance and societal change could be more nuanced.\n===EVALUATION_END===",
  "created_at": "2025-08-28T14:10:37.651133+00:00"
}